SCIENTIFIC_NAME,COMMON_NAME,SPECIES_CODE,CATEGORY,TAXON_ORDER,COM_NAME_CODES,SCI_NAME_CODES,BANDING_CODES,ORDER,FAMILY_COM_NAME,FAMILY_SCI_NAME,REPORT_AS,EXTINCT,EXTINCT_YEAR,FAMILY_CODE
Apteryx australis x mantelli,Southern Brown x North Island Brown Kiwi (hybrid),x01217,hybrid,26.0,NIBK SBKI,APMA APAU,,Apterygiformes,Kiwis,Apterygidae,,,,aptery1
Apteryx rowi x owenii,Okarito Brown x Little Spotted Kiwi (hybrid),x01059,hybrid,28.0,OBKI LSKI OKKI,APOW APRO,,Apterygiformes,Kiwis,Apterygidae,,,,aptery1
Dendrocygna guttata x viduata,Spotted x White-faced Whistling-Duck (hybrid),x00721,hybrid,241.0,SPWD WFWD SWDU,DEGU DEVI,,Anseriformes,"Ducks, Geese, and Waterfowl",Anatidae,,,,anatid1
Dendrocygna eytoni x viduata,Plumed x White-faced Whistling-Duck (hybrid),x01218,hybrid,242.0,PLWD WFWD PWDU,DEEY DEVI,,Anseriformes,"Ducks, Geese, and Waterfowl",Anatidae,,,,anatid1
Dendrocygna viduata x autumnalis,White-faced x Black-bellied Whistling-Duck (hybrid),x01141,hybrid,246.0,WFWD BBWD,DEAU DEVI,,Anseriformes,"Ducks, Geese, and Waterfowl",Anatidae,,,,anatid1
Dendrocygna autumnalis x arborea,Black-bellied x West Indian Whistling-Duck (hybrid),x00775,hybrid,248.0,BBWD WIWD,DEAR DEAU,,Anseriformes,"Ducks, Geese, and Waterfowl",Anatidae,,,,anatid1
Dendrocygna viduata x bicolor,White-faced x Fulvous Whistling-Duck (hybrid),x00938,hybrid,250.0,WFWD FUWD FWDU,DEVI DEBI,,Anseriformes,"Ducks, Geese, and Waterfowl",Anatidae,,,,anatid1
Dendrocygna autumnalis x bicolor,Black-bellied x Fulvous Whistling-Duck (hybrid),x00875,hybrid,251.0,FUWD BBWD FWDU,DEAU DEBI,,Anseriformes,"Ducks, Geese, and Waterfowl",Anatidae,,,,anatid1
Dendrocygna eytoni x arcuata,Plumed x Wandering Whistling-Duck (hybrid),x00990,hybrid,256.0,WWDU PLWD PWDU WAWD,DEAR DEEY,,Anseriformes,"Ducks, Geese, and Waterfowl",Anatidae,,,,anatid1
Dendrocygna arcuata x javanica,Wandering x Lesser Whistling-Duck (hybrid),x00360,hybrid,260.0,WWDU LEWD LWDU WAWD,DEAR DEJA,,Anseriformes,"Ducks, Geese, and Waterfowl",Anatidae,,,,anatid1
Anser indicus x caerulescens,Bar-headed x Snow Goose (hybrid),x00991,hybrid,270.0,BHGO SNGO,ANIN ANCA,,Anseriformes,"Ducks, Geese, and Waterfowl",Anatidae,,,,anatid1
Anser canagicus x caerulescens,Emperor x Snow Goose (hybrid),x01176,hybrid,271.0,EMGO SNGO,ANCA,,Anseriformes,"Ducks, Geese, and Waterfowl",Anatidae,,,,anatid1
Anser caerulescens x rossii,Snow x Ross's Goose (hybrid),sxrgoo1,hybrid,273.0,SNGO ROGO,ANRO ANCA,SRGH,Anseriformes,"Ducks, Geese, and Waterfowl",Anatidae,,,,anatid1
Anser indicus x anser,Bar-headed x Graylag Goose (hybrid),x00992,hybrid,279.0,BHGO GRGO,ANAN ANIN,,Anseriformes,"Ducks, Geese, and Waterfowl",Anatidae,,,,anatid1
Anser canagicus x anser,Emperor x Graylag Goose (hybrid),x01119,hybrid,280.0,EMGO GRGO,ANAN ANCA,,Anseriformes,"Ducks, Geese, and Waterfowl",Anatidae,,,,anatid1
Anser indicus x cygnoides,Bar-headed x Swan Goose (hybrid),x01143,hybrid,283.0,BHGO SWGO,ANIN ANCY,,Anseriformes,"Ducks, Geese, and Waterfowl",Anatidae,,,,anatid1
Anser caerulescens x cygnoides,Snow x Swan Goose (hybrid),x01144,hybrid,284.0,SNGO SWGO,ANCA ANCY,,Anseriformes,"Ducks, Geese, and Waterfowl",Anatidae,,,,anatid1
Anser indicus x caerulescens x cygnoides,Bar-headed x Snow x Swan Goose (hybrid),x01142,hybrid,285.0,SNGO BHGO SWGO,ANIN ANCA ANCY,,Anseriformes,"Ducks, Geese, and Waterfowl",Anatidae,,,,anatid1
Anser anser x cygnoides,Graylag x Swan Goose (hybrid),x00776,hybrid,286.0,GRGO SWGO,ANAN ANCY,,Anseriformes,"Ducks, Geese, and Waterfowl",Anatidae,,,,anatid1
Anser indicus x albifrons,Bar-headed x Greater White-fronted Goose (hybrid),x00755,hybrid,294.0,GWFG BHGO,ANIN ANAL,,Anseriformes,"Ducks, Geese, and Waterfowl",Anatidae,,,,anatid1
Anser canagicus x albifrons,Emperor x Greater White-fronted Goose (hybrid),x00361,hybrid,295.0,GWFG EMGO,ANCA ANAL,,Anseriformes,"Ducks, Geese, and Waterfowl",Anatidae,,,,anatid1
Anser caerulescens x albifrons,Snow x Greater White-fronted Goose (hybrid),x00627,hybrid,296.0,GWFG SNGO,ANCA ANAL,,Anseriformes,"Ducks, Geese, and Waterfowl",Anatidae,,,,anatid1
Anser rossii x albifrons,Ross's x Greater White-fronted Goose (hybrid),x00362,hybrid,297.0,GWFG ROGO,ANRO ANAL,,Anseriformes,"Ducks, Geese, and Waterfowl",Anatidae,,,,anatid1
Anser anser x albifrons,Graylag x Greater White-fronted Goose (hybrid),x01145,hybrid,298.0,GWFG GRGO,ANAN ANAL,,Anseriformes,"Ducks, Geese, and Waterfowl",Anatidae,,,,anatid1
Anser albifrons x serrirostris,Greater White-fronted Goose x Tundra Bean-Goose (hybrid),x01089,hybrid,309.0,GWFG TUBG TBGO BEGO,ANSE ANAL,,Anseriformes,"Ducks, Geese, and Waterfowl",Anatidae,,,,anatid1
Anser caerulescens x Branta bernicla,Snow Goose x Brant (hybrid),x00685,hybrid,321.0,SNGO BRAN BRGO,BRBE ANCA,,Anseriformes,"Ducks, Geese, and Waterfowl",Anatidae,,,,anatid1
Anser indicus x Branta leucopsis,Bar-headed x Barnacle Goose (hybrid),x00363,hybrid,323.0,BHGO BAGO BARG,ANIN BRLE,,Anseriformes,"Ducks, Geese, and Waterfowl",Anatidae,,,,anatid1
Anser canagicus x Branta leucopsis,Emperor x Barnacle Goose (hybrid),x00993,hybrid,324.0,EMGO BAGO BARG,ANCA BRLE,,Anseriformes,"Ducks, Geese, and Waterfowl",Anatidae,,,,anatid1
Anser caerulescens x Branta leucopsis,Snow x Barnacle Goose (hybrid),x00994,hybrid,325.0,BAGO SNGO BARG,ANCA BRLE,,Anseriformes,"Ducks, Geese, and Waterfowl",Anatidae,,,,anatid1
Anser rossii x Branta leucopsis,Ross's x Barnacle Goose (hybrid),x00995,hybrid,326.0,BAGO BARG ROGO,ANRO BRLE,,Anseriformes,"Ducks, Geese, and Waterfowl",Anatidae,,,,anatid1
Anser anser x Branta leucopsis,Graylag x Barnacle Goose (hybrid),x00649,hybrid,327.0,BAGO BARG GRGO,ANAN BRLE,,Anseriformes,"Ducks, Geese, and Waterfowl",Anatidae,,,,anatid1
Anser albifrons x Branta leucopsis,Greater White-fronted x Barnacle Goose (hybrid),x00757,hybrid,328.0,GWFG BAGO BARG,BRLE ANAL,,Anseriformes,"Ducks, Geese, and Waterfowl",Anatidae,,,,anatid1
Anser erythropus x Branta leucopsis,Lesser White-fronted x Barnacle Goose (hybrid),x00364,hybrid,329.0,BAGO BARG LWFG,ANER BRLE,,Anseriformes,"Ducks, Geese, and Waterfowl",Anatidae,,,,anatid1
Anser brachyrhynchus x Branta leucopsis,Pink-footed x Barnacle Goose (hybrid),x00756,hybrid,330.0,BAGO BARG PFGO,BRLE ANBR,,Anseriformes,"Ducks, Geese, and Waterfowl",Anatidae,,,,anatid1
Anser canagicus x Branta hutchinsii,Emperor x Cackling Goose (hybrid),x00831,hybrid,336.0,EMGO CACG CAGO,ANCA BRHU,,Anseriformes,"Ducks, Geese, and Waterfowl",Anatidae,,,,anatid1
Anser caerulescens x Branta hutchinsii,Snow x Cackling Goose (hybrid),x00692,hybrid,337.0,CACG SNGO CAGO,ANCA BRHU,,Anseriformes,"Ducks, Geese, and Waterfowl",Anatidae,,,,anatid1
Anser rossii x Branta hutchinsii,Ross's x Cackling Goose (hybrid),x00694,hybrid,338.0,CAGO CACG ROGO,ANRO BRHU,,Anseriformes,"Ducks, Geese, and Waterfowl",Anatidae,,,,anatid1
Branta bernicla x hutchinsii,Brant x Cackling Goose (hybrid),x00722,hybrid,339.0,CAGO BRAN CACG BRGO,BRBE BRHU,,Anseriformes,"Ducks, Geese, and Waterfowl",Anatidae,,,,anatid1
Anser albifrons x Branta hutchinsii,Greater White-fronted x Cackling Goose (hybrid),x00414,hybrid,340.0,GWFG CACG CAGO,BRHU ANAL,,Anseriformes,"Ducks, Geese, and Waterfowl",Anatidae,,,,anatid1
Branta leucopsis x hutchinsii,Barnacle x Cackling Goose (hybrid),x00416,hybrid,341.0,BAGO CAGO BARG CACG,BRHU BRLE,,Anseriformes,"Ducks, Geese, and Waterfowl",Anatidae,,,,anatid1
Anser indicus x Branta canadensis,Bar-headed x Canada Goose (hybrid),x00908,hybrid,353.0,CANG BHGO CAGO,ANIN BRCA,,Anseriformes,"Ducks, Geese, and Waterfowl",Anatidae,,,,anatid1
Anser cygnoides x Branta canadensis,Swan x Canada Goose (hybrid),swagoo3,hybrid,354.0,CANG CAGO SWGO,ANCY BRCA,,Anseriformes,"Ducks, Geese, and Waterfowl",Anatidae,,,,anatid1
Anser brachyrhynchus x Branta canadensis,Pink-footed x Canada Goose (hybrid),x00650,hybrid,355.0,CANG CAGO PFGO,BRCA ANBR,,Anseriformes,"Ducks, Geese, and Waterfowl",Anatidae,,,,anatid1
Anser albifrons x Branta canadensis,Greater White-fronted x Canada Goose (hybrid),x00415,hybrid,356.0,CANG GWFG CAGO,BRCA ANAL,,Anseriformes,"Ducks, Geese, and Waterfowl",Anatidae,,,,anatid1
Anser albifrons x Branta hutchinsii/canadensis,Greater White-fronted x Cackling/Canada Goose (hybrid),x01088,hybrid,357.0,CANG GWFG CAGO CACG CCGO,BRCA ANAL BRHU,,Anseriformes,"Ducks, Geese, and Waterfowl",Anatidae,,,,anatid1
Anser anser x Branta canadensis,Graylag x Canada Goose (hybrid),x00758,hybrid,358.0,CANG CAGO GRGO,ANAN BRCA,,Anseriformes,"Ducks, Geese, and Waterfowl",Anatidae,,,,anatid1
Anser sp. (Domestic type) x Branta canadensis,Domestic goose sp. x Canada Goose (hybrid),x00759,hybrid,359.0,CANG CAGO DGSP,BRCA,,Anseriformes,"Ducks, Geese, and Waterfowl",Anatidae,,,,anatid1
Anser caerulescens x Branta canadensis,Snow x Canada Goose (hybrid),x00197,hybrid,360.0,CANG SNGO CAGO,BRCA ANCA,,Anseriformes,"Ducks, Geese, and Waterfowl",Anatidae,,,,anatid1
Anser rossii x Branta canadensis,Ross's x Canada Goose (hybrid),x00693,hybrid,361.0,CANG CAGO ROGO,ANRO BRCA,,Anseriformes,"Ducks, Geese, and Waterfowl",Anatidae,,,,anatid1
Branta leucopsis x canadensis,Barnacle x Canada Goose (hybrid),x00417,hybrid,362.0,CANG CAGO BAGO BARG,BRCA BRLE,,Anseriformes,"Ducks, Geese, and Waterfowl",Anatidae,,,,anatid1
Anser caerulescens/rossii x Branta hutchinsii/canadensis,Snow/Ross's x Cackling/Canada Goose (hybrid),y00765,hybrid,364.0,SRGO ROGO SNGO CCGO CANG CAGO CACG,BRCA BRHU ANRO ANCA,,Anseriformes,"Ducks, Geese, and Waterfowl",Anatidae,,,,anatid1
Branta leucopsis x sandvicensis,Barnacle x Hawaiian Goose (hybrid),x01139,hybrid,366.0,HAGO BAGO NENE BARG,BRSA BRLE,,Anseriformes,"Ducks, Geese, and Waterfowl",Anatidae,,,,anatid1
Anser albifrons x Branta ruficollis,Greater White-fronted x Red-breasted Goose (hybrid),x00939,hybrid,368.0,GWFG RBGO,BRRU ANAL,,Anseriformes,"Ducks, Geese, and Waterfowl",Anatidae,,,,anatid1
Branta bernicla x ruficollis,Brant x Red-breasted Goose (hybrid),x00996,hybrid,369.0,BRAN RBGO BRGO,BRRU BRBE,,Anseriformes,"Ducks, Geese, and Waterfowl",Anatidae,,,,anatid1
Branta leucopsis x ruficollis,Barnacle x Red-breasted Goose (hybrid),x00365,hybrid,370.0,BAGO BARG RBGO,BRRU BRLE,,Anseriformes,"Ducks, Geese, and Waterfowl",Anatidae,,,,anatid1
Anser anser x Cygnus olor,Graylag Goose x Mute Swan (hybrid),x00366,hybrid,378.0,MUSW GRGO,CYOL ANAN,,Anseriformes,"Ducks, Geese, and Waterfowl",Anatidae,,,,anatid1
Cygnus olor x atratus,Mute x Black Swan (hybrid),x01037,hybrid,380.0,MUSW BLSW,CYOL CYAT,,Anseriformes,"Ducks, Geese, and Waterfowl",Anatidae,,,,anatid1
Cygnus olor x buccinator,Mute x Trumpeter Swan (hybrid),x00832,hybrid,383.0,MUSW TRSW TRUS,CYOL CYBU,,Anseriformes,"Ducks, Geese, and Waterfowl",Anatidae,,,,anatid1
Cygnus buccinator x columbianus,Trumpeter x Tundra Swan (hybrid),x00418,hybrid,388.0,BESW TUSW TRUS TRSW,CYCO CYBU,,Anseriformes,"Ducks, Geese, and Waterfowl",Anatidae,,,,anatid1
Cygnus olor x cygnus,Mute x Whooper Swan (hybrid),x00997,hybrid,391.0,MUSW WHOS WHSW,CYOL CYCY,,Anseriformes,"Ducks, Geese, and Waterfowl",Anatidae,,,,anatid1
Cygnus buccinator x cygnus,Trumpeter x Whooper Swan (hybrid),x00419,hybrid,392.0,TRUS WHOS TRSW WHSW,CYBU CYCY,,Anseriformes,"Ducks, Geese, and Waterfowl",Anatidae,,,,anatid1
Chloephaga poliocephala x rubidiceps,Ashy-headed x Ruddy-headed Goose (hybrid),x01120,hybrid,411.0,RHGO AHGO,CHRU CHPO,,Anseriformes,"Ducks, Geese, and Waterfowl",Anatidae,,,,anatid1
Sarkidiornis melanotos x Alopochen aegyptiaca,Knob-billed Duck x Egyptian Goose (hybrid),x01177,hybrid,418.0,EGGO KBDU,SAME ALAE,,Anseriformes,"Ducks, Geese, and Waterfowl",Anatidae,,,,anatid1
Alopochen aegyptiaca x Tadorna ferruginea,Egyptian Goose x Ruddy Shelduck (hybrid),x00367,hybrid,422.0,EGGO RUSH,ALAE TAFE,,Anseriformes,"Ducks, Geese, and Waterfowl",Anatidae,,,,anatid1
Tadorna ferruginea x tadorna,Ruddy x Common Shelduck (hybrid),x00876,hybrid,427.0,COMS RUSH COSH,TATA TAFE,,Anseriformes,"Ducks, Geese, and Waterfowl",Anatidae,,,,anatid1
Alopochen aegyptiaca x Cairina moschata,Egyptian Goose x Muscovy Duck (hybrid),x01045,hybrid,447.0,MUDU EGGO,ALAE CAMO,,Anseriformes,"Ducks, Geese, and Waterfowl",Anatidae,,,,anatid1
Tadorna tadorna x Aix sponsa,Common Shelduck x Wood Duck (hybrid),x00940,hybrid,456.0,AWDU WODU CWDU COMS COSH,TATA AISP,,Anseriformes,"Ducks, Geese, and Waterfowl",Anatidae,,,,anatid1
Aix sponsa x galericulata,Wood x Mandarin Duck (hybrid),x00833,hybrid,458.0,AWDU WODU CWDU MADU,AIGA AISP,,Anseriformes,"Ducks, Geese, and Waterfowl",Anatidae,,,,anatid1
Aix sponsa x Amazonetta brasiliensis,Wood Duck x Brazilian Teal (hybrid),x01178,hybrid,464.0,WODU AWDU CWDU BRTE,AMBR AISP,,Anseriformes,"Ducks, Geese, and Waterfowl",Anatidae,,,,anatid1
Sibirionetta formosa x Spatula discors,Baikal x Blue-winged Teal (hybrid),x01179,hybrid,486.0,BWTE BATE,SPDI SIFO,,Anseriformes,"Ducks, Geese, and Waterfowl",Anatidae,,,,anatid1
Spatula discors x cyanoptera,Blue-winged x Cinnamon Teal (hybrid),bwxtea1,hybrid,494.0,CITE BWTE,SPDI SPCY,,Anseriformes,"Ducks, Geese, and Waterfowl",Anatidae,,,,anatid1
Spatula querquedula x clypeata,Garganey x Northern Shoveler (hybrid),x00836,hybrid,502.0,NSHO NOSH GARG,SPCL SPQU,,Anseriformes,"Ducks, Geese, and Waterfowl",Anatidae,,,,anatid1
Spatula discors x clypeata,Blue-winged Teal x Northern Shoveler (hybrid),x00629,hybrid,503.0,NSHO BWTE NOSH,SPDI SPCL,,Anseriformes,"Ducks, Geese, and Waterfowl",Anatidae,,,,anatid1
Spatula cyanoptera x clypeata,Cinnamon Teal x Northern Shoveler (hybrid),x00630,hybrid,504.0,CITE NSHO NOSH,SPCL SPCY,,Anseriformes,"Ducks, Geese, and Waterfowl",Anatidae,,,,anatid1
Spatula clypeata x Mareca strepera,Northern Shoveler x Gadwall (hybrid),x00457,hybrid,508.0,NSHO GADW NOSH,SPCL MAST,,Anseriformes,"Ducks, Geese, and Waterfowl",Anatidae,,,,anatid1
Sibirionetta formosa x Mareca falcata,Baikal Teal x Falcated Duck (hybrid),x00368,hybrid,510.0,FADU BATE,MAFA SIFO,,Anseriformes,"Ducks, Geese, and Waterfowl",Anatidae,,,,anatid1
Mareca strepera x falcata,Gadwall x Falcated Duck (hybrid),x00369,hybrid,511.0,GADW FADU,MAFA MAST,,Anseriformes,"Ducks, Geese, and Waterfowl",Anatidae,,,,anatid1
Sibirionetta formosa x Mareca penelope,Baikal Teal x Eurasian Wigeon (hybrid),x01219,hybrid,513.0,EUWI BATE,SIFO MAPE,,Anseriformes,"Ducks, Geese, and Waterfowl",Anatidae,,,,anatid1
Spatula clypeata x Mareca penelope,Northern Shoveler x Eurasian Wigeon (hybrid),x01140,hybrid,514.0,NSHO NOSH EUWI,SPCL MAPE,,Anseriformes,"Ducks, Geese, and Waterfowl",Anatidae,,,,anatid1
Mareca strepera x penelope,Gadwall x Eurasian Wigeon (hybrid),x00723,hybrid,515.0,GADW EUWI,MAST MAPE,,Anseriformes,"Ducks, Geese, and Waterfowl",Anatidae,,,,anatid1
Mareca falcata x penelope,Falcated Duck x Eurasian Wigeon (hybrid),x01220,hybrid,516.0,FADU EUWI,MAFA MAPE,,Anseriformes,"Ducks, Geese, and Waterfowl",Anatidae,,,,anatid1
Aix sponsa x Mareca americana,Wood Duck x American Wigeon (hybrid),x00877,hybrid,518.0,AMWI WODU AWDU CWDU,AISP MAAM,,Anseriformes,"Ducks, Geese, and Waterfowl",Anatidae,,,,anatid1
Spatula discors x Mareca americana,Blue-winged Teal x American Wigeon (hybrid),x00370,hybrid,519.0,AMWI BWTE,SPDI MAAM,,Anseriformes,"Ducks, Geese, and Waterfowl",Anatidae,,,,anatid1
Spatula clypeata x Mareca americana,Northern Shoveler x American Wigeon (hybrid),x00777,hybrid,520.0,NSHO AMWI NOSH,SPCL MAAM,,Anseriformes,"Ducks, Geese, and Waterfowl",Anatidae,,,,anatid1
Mareca strepera x americana,Gadwall x American Wigeon (hybrid),x00724,hybrid,521.0,GADW AMWI,MAST MAAM,,Anseriformes,"Ducks, Geese, and Waterfowl",Anatidae,,,,anatid1
Mareca penelope x americana,Eurasian x American Wigeon (hybrid),x00421,hybrid,522.0,AMWI EUWI,MAPE MAAM,,Anseriformes,"Ducks, Geese, and Waterfowl",Anatidae,,,,anatid1
Mareca penelope x sibilatrix,Eurasian x Chiloe Wigeon (hybrid),x00998,hybrid,525.0,CHWI EUWI,MASI MAPE,,Anseriformes,"Ducks, Geese, and Waterfowl",Anatidae,,,,anatid1
Alopochen aegyptiaca x Anas platyrhynchos,Egyptian Goose x Mallard (hybrid),x01147,hybrid,549.0,EGGO MALL,ALAE ANPL,,Anseriformes,"Ducks, Geese, and Waterfowl",Anatidae,,,,anatid1
Tadorna ferruginea x Anas platyrhynchos,Ruddy Shelduck x Mallard (hybrid),x01148,hybrid,550.0,RUSH MALL,TAFE ANPL,,Anseriformes,"Ducks, Geese, and Waterfowl",Anatidae,,,,anatid1
Cairina moschata x Anas platyrhynchos,Muscovy Duck x Mallard (hybrid),mdxmal1,hybrid,551.0,MUDU MALL,ANPL CAMO,,Anseriformes,"Ducks, Geese, and Waterfowl",Anatidae,,,,anatid1
Aix sponsa x Anas platyrhynchos,Wood Duck x Mallard (hybrid),x00205,hybrid,552.0,WODU AWDU CWDU MALL,ANPL AISP,,Anseriformes,"Ducks, Geese, and Waterfowl",Anatidae,,,,anatid1
Spatula clypeata x Anas platyrhynchos,Northern Shoveler x Mallard (hybrid),x00612,hybrid,553.0,NSHO NOSH MALL,SPCL ANPL,,Anseriformes,"Ducks, Geese, and Waterfowl",Anatidae,,,,anatid1
Mareca strepera x Anas platyrhynchos,Gadwall x Mallard (hybrid),x00420,hybrid,554.0,GADW MALL,MAST ANPL,,Anseriformes,"Ducks, Geese, and Waterfowl",Anatidae,,,,anatid1
Mareca falcata x Anas platyrhynchos,Falcated Duck x Mallard (hybrid),x01221,hybrid,555.0,FADU MALL,MAFA ANPL,,Anseriformes,"Ducks, Geese, and Waterfowl",Anatidae,,,,anatid1
Mareca penelope x Anas platyrhynchos,Eurasian Wigeon x Mallard (hybrid),x00647,hybrid,556.0,EUWI MALL,MAPE ANPL,,Anseriformes,"Ducks, Geese, and Waterfowl",Anatidae,,,,anatid1
Mareca americana x Anas platyrhynchos,American Wigeon x Mallard (hybrid),x00611,hybrid,557.0,AMWI MALL,ANPL MAAM,,Anseriformes,"Ducks, Geese, and Waterfowl",Anatidae,,,,anatid1
Anas sparsa x platyrhynchos,African Black Duck x Mallard (hybrid),x01149,hybrid,558.0,ABDU MALL,ANSP ANPL,,Anseriformes,"Ducks, Geese, and Waterfowl",Anatidae,,,,anatid1
Anas undulata x platyrhynchos,Yellow-billed Duck x Mallard (hybrid),x00760,hybrid,559.0,MALL YBDU,ANUN ANPL,,Anseriformes,"Ducks, Geese, and Waterfowl",Anatidae,,,,anatid1
Anas superciliosa x platyrhynchos,Pacific Black Duck x Mallard (hybrid),x00458,hybrid,560.0,GRDU PBDU MALL,ANSU ANPL,,Anseriformes,"Ducks, Geese, and Waterfowl",Anatidae,,,,anatid1
Anas wyvilliana x platyrhynchos,Hawaiian Duck x Mallard (hybrid),x00423,hybrid,561.0,HADU MALL HAWD,ANWY ANPL,MHDH,Anseriformes,"Ducks, Geese, and Waterfowl",Anatidae,,,,anatid1
Anas poecilorhyncha x platyrhynchos,Indian Spot-billed Duck x Mallard (hybrid),x00834,hybrid,562.0,ISBD MALL,ANPO ANPL,,Anseriformes,"Ducks, Geese, and Waterfowl",Anatidae,,,,anatid1
Anas zonorhyncha x platyrhynchos,Eastern Spot-billed Duck x Mallard (hybrid),x00835,hybrid,563.0,ESBD CSBD MALL,ANZO ANPL,,Anseriformes,"Ducks, Geese, and Waterfowl",Anatidae,,,,anatid1
Anas platyrhynchos x diazi,Mallard x Mexican Duck (hybrid),mallar4,hybrid,569.0,MEDU MALL MODU,ANDI ANPL,,Anseriformes,"Ducks, Geese, and Waterfowl",Anatidae,,,,anatid1
Mareca americana x Anas rubripes,American Wigeon x American Black Duck (hybrid),x00941,hybrid,572.0,ABDU AMWI,ANRU MAAM,,Anseriformes,"Ducks, Geese, and Waterfowl",Anatidae,,,,anatid1
Anas platyrhynchos x rubripes,Mallard x American Black Duck (hybrid),x00004,hybrid,573.0,ABDU MALL,ANRU ANPL,MBDH,Anseriformes,"Ducks, Geese, and Waterfowl",Anatidae,,,,anatid1
Anas platyrhynchos x fulvigula,Mallard x Mottled Duck (hybrid),x00422,hybrid,578.0,MODU MALL,ANFU ANPL,,Anseriformes,"Ducks, Geese, and Waterfowl",Anatidae,,,,anatid1
Anas platyrhynchos x diazi/fulvigula,Mallard x Mexican/Mottled Duck (hybrid),y01098,hybrid,579.0,MEDU MODU MALL,ANDI ANFU ANPL,,Anseriformes,"Ducks, Geese, and Waterfowl",Anatidae,,,,anatid1
Anas diazi x fulvigula,Mexican x Mottled Duck (hybrid),x00922,hybrid,580.0,MEDU MODU,ANDI ANFU,,Anseriformes,"Ducks, Geese, and Waterfowl",Anatidae,,,,anatid1
Anas platyrhynchos x bahamensis,Mallard x White-cheeked Pintail (hybrid),x00778,hybrid,590.0,WCHP WCPI MALL,ANBA ANPL,,Anseriformes,"Ducks, Geese, and Waterfowl",Anatidae,,,,anatid1
Anas undulata x erythrorhyncha,Yellow-billed x Red-billed Duck (hybrid),x01222,hybrid,592.0,RBTE RBDU YBDU,ANER ANUN,,Anseriformes,"Ducks, Geese, and Waterfowl",Anatidae,,,,anatid1
Anas capensis x erythrorhyncha,Cape Teal x Red-billed Duck (hybrid),x01223,hybrid,593.0,CATE RBTE RBDU,ANER ANCA,,Anseriformes,"Ducks, Geese, and Waterfowl",Anatidae,,,,anatid1
Sibirionetta formosa x Anas acuta,Baikal Teal x Northern Pintail (hybrid),x00837,hybrid,595.0,BATE NOPI,ANAC SIFO,,Anseriformes,"Ducks, Geese, and Waterfowl",Anatidae,,,,anatid1
Spatula clypeata x Anas acuta,Northern Shoveler x Northern Pintail (hybrid),x01180,hybrid,596.0,NSHO NOPI NOSH,SPCL ANAC,,Anseriformes,"Ducks, Geese, and Waterfowl",Anatidae,,,,anatid1
Mareca strepera x Anas acuta,Gadwall x Northern Pintail (hybrid),x00610,hybrid,597.0,GADW NOPI,ANAC MAST,,Anseriformes,"Ducks, Geese, and Waterfowl",Anatidae,,,,anatid1
Mareca penelope x Anas acuta,Eurasian Wigeon x Northern Pintail (hybrid),x00761,hybrid,598.0,NOPI EUWI,ANAC MAPE,,Anseriformes,"Ducks, Geese, and Waterfowl",Anatidae,,,,anatid1
Mareca americana x Anas acuta,American Wigeon x Northern Pintail (hybrid),x00196,hybrid,599.0,AMWI NOPI,ANAC MAAM,,Anseriformes,"Ducks, Geese, and Waterfowl",Anatidae,,,,anatid1
Anas superciliosa x acuta,Pacific Black Duck x Northern Pintail (hybrid),x01087,hybrid,600.0,GRDU PBDU NOPI,ANSU ANAC,,Anseriformes,"Ducks, Geese, and Waterfowl",Anatidae,,,,anatid1
Anas platyrhynchos x acuta,Mallard x Northern Pintail (hybrid),x00628,hybrid,601.0,NOPI MALL,ANAC ANPL,,Anseriformes,"Ducks, Geese, and Waterfowl",Anatidae,,,,anatid1
Anas rubripes x acuta,American Black Duck x Northern Pintail (hybrid),x00674,hybrid,602.0,ABDU NOPI,ANAC ANRU,,Anseriformes,"Ducks, Geese, and Waterfowl",Anatidae,,,,anatid1
Anas bahamensis x georgica,White-cheeked x Yellow-billed Pintail (hybrid),x01150,hybrid,611.0,WCHP WCPI YBPI,ANGE ANBA,,Anseriformes,"Ducks, Geese, and Waterfowl",Anatidae,,,,anatid1
Sibirionetta formosa x Anas crecca,Baikal x Green-winged Teal (hybrid),x00999,hybrid,616.0,GWTE EUTE CWTE EWTE BATE,SIFO ANCR,,Anseriformes,"Ducks, Geese, and Waterfowl",Anatidae,,,,anatid1
Spatula querquedula x Anas crecca,Garganey x Green-winged Teal (hybrid),x00371,hybrid,617.0,GWTE EUTE CWTE EWTE GARG,ANCR SPQU,,Anseriformes,"Ducks, Geese, and Waterfowl",Anatidae,,,,anatid1
Spatula discors x Anas crecca,Blue-winged x Green-winged Teal (hybrid),x00673,hybrid,618.0,GWTE BWTE EUTE CWTE EWTE,SPDI ANCR,,Anseriformes,"Ducks, Geese, and Waterfowl",Anatidae,,,,anatid1
Spatula cyanoptera x Anas crecca,Cinnamon x Green-winged Teal (hybrid),x00763,hybrid,619.0,CITE GWTE EUTE CWTE EWTE,SPCY ANCR,,Anseriformes,"Ducks, Geese, and Waterfowl",Anatidae,,,,anatid1
Mareca strepera x Anas crecca,Gadwall x Green-winged Teal (hybrid),x00762,hybrid,620.0,GWTE EUTE CWTE EWTE GADW,MAST ANCR,,Anseriformes,"Ducks, Geese, and Waterfowl",Anatidae,,,,anatid1
Mareca penelope x Anas crecca,Eurasian Wigeon x Green-winged Teal (hybrid),x00372,hybrid,621.0,GWTE EUTE CWTE EUWI EWTE,ANCR MAPE,,Anseriformes,"Ducks, Geese, and Waterfowl",Anatidae,,,,anatid1
Mareca americana x Anas crecca,American Wigeon x Green-winged Teal (hybrid),x00646,hybrid,622.0,GWTE AMWI EUTE CWTE EWTE,ANCR MAAM,,Anseriformes,"Ducks, Geese, and Waterfowl",Anatidae,,,,anatid1
Anas platyrhynchos x crecca,Mallard x Green-winged Teal (hybrid),x00670,hybrid,623.0,GWTE EUTE CWTE EWTE MALL,ANCR ANPL,,Anseriformes,"Ducks, Geese, and Waterfowl",Anatidae,,,,anatid1
Anas acuta x crecca,Northern Pintail x Green-winged Teal (hybrid),x00725,hybrid,624.0,GWTE EUTE CWTE EWTE NOPI,ANAC ANCR,,Anseriformes,"Ducks, Geese, and Waterfowl",Anatidae,,,,anatid1
Anas superciliosa x gracilis,Pacific Black Duck x Gray Teal (hybrid),x00926,hybrid,640.0,GRDU GRTE PBDU,ANSU ANGR,,Anseriformes,"Ducks, Geese, and Waterfowl",Anatidae,,,,anatid1
Anas superciliosa x castanea,Pacific Black Duck x Chestnut Teal (hybrid),x00925,hybrid,645.0,CHTE GRDU PBDU,ANSU ANCA,,Anseriformes,"Ducks, Geese, and Waterfowl",Anatidae,,,,anatid1
Anas gracilis x castanea,Gray x Chestnut Teal (hybrid),x00913,hybrid,646.0,CHTE GRTE,ANCA ANGR,,Anseriformes,"Ducks, Geese, and Waterfowl",Anatidae,,,,anatid1
Anas platyrhynchos x chlorotis,Mallard x Brown Teal (hybrid),x00878,hybrid,652.0,BRTE MALL,ANCH ANPL,,Anseriformes,"Ducks, Geese, and Waterfowl",Anatidae,,,,anatid1
Anas platyrhynchos x Netta rufina,Mallard x Red-crested Pochard (hybrid),x00648,hybrid,661.0,RCPO MALL,NERU ANPL,,Anseriformes,"Ducks, Geese, and Waterfowl",Anatidae,,,,anatid1
Anas platyrhynchos x Aythya americana,Mallard x Redhead (hybrid),x00879,hybrid,668.0,REDH MALL,AYAM ANPL,,Anseriformes,"Ducks, Geese, and Waterfowl",Anatidae,,,,anatid1
Aythya valisineria x americana,Canvasback x Redhead (hybrid),x00684,hybrid,669.0,REDH CANV,AYVA AYAM,,Anseriformes,"Ducks, Geese, and Waterfowl",Anatidae,,,,anatid1
Anas platyrhynchos x Aythya ferina,Mallard x Common Pochard (hybrid),x01000,hybrid,671.0,COPO COMP MALL,AYFE ANPL,,Anseriformes,"Ducks, Geese, and Waterfowl",Anatidae,,,,anatid1
Netta rufina x Aythya ferina,Red-crested x Common Pochard (hybrid),x00373,hybrid,672.0,COMP COPO RCPO,AYFE NERU,,Anseriformes,"Ducks, Geese, and Waterfowl",Anatidae,,,,anatid1
Anas platyrhynchos x Aythya collaris,Mallard x Ring-necked Duck (hybrid),x01001,hybrid,674.0,MALL RNDU,AYCO ANPL,,Anseriformes,"Ducks, Geese, and Waterfowl",Anatidae,,,,anatid1
Aythya valisineria x collaris,Canvasback x Ring-necked Duck (hybrid),x00880,hybrid,675.0,CANV RNDU,AYVA AYCO,,Anseriformes,"Ducks, Geese, and Waterfowl",Anatidae,,,,anatid1
Aythya americana x collaris,Redhead x Ring-necked Duck (hybrid),x00679,hybrid,676.0,REDH RNDU,AYAM AYCO,,Anseriformes,"Ducks, Geese, and Waterfowl",Anatidae,,,,anatid1
Netta rufina x Aythya nyroca,Red-crested Pochard x Ferruginous Duck (hybrid),x00374,hybrid,678.0,FEDU RCPO,AYNY NERU,,Anseriformes,"Ducks, Geese, and Waterfowl",Anatidae,,,,anatid1
Aythya ferina x nyroca,Common Pochard x Ferruginous Duck (hybrid),x00764,hybrid,679.0,FEDU COPO COMP,AYNY AYFE,,Anseriformes,"Ducks, Geese, and Waterfowl",Anatidae,,,,anatid1
Aythya ferina x baeri,Common x Baer's Pochard (hybrid),x01093,hybrid,682.0,COPO COMP BAPO,AYFE AYBA,,Anseriformes,"Ducks, Geese, and Waterfowl",Anatidae,,,,anatid1
