SCIENTIFIC_NAME,COMMON_NAME,SPECIES_CODE,CATEGORY,TAXON_ORDER,COM_NAME_CODES,SCI_NAME_CODES,BANDING_CODES,ORDER,FAMILY_COM_NAME,FAMILY_SCI_NAME,REPORT_AS,EXTINCT,EXTINCT_YEAR,FAMILY_CODE
Calidris canutus x virgata,Red Knot x Surfbird (hybrid),x00675,hybrid,6176.0,REKN SURF,CAVI CACA,,Charadriiformes,Sandpipers and Allies,Scolopacidae,,,,scolop2
Calidris alpina x maritima,Dunlin x Purple Sandpiper (hybrid),x00433,hybrid,6208.0,PUSA DUNL,CAMA CAAL,,Charadriiformes,Sandpipers and Allies,Scolopacidae,,,,scolop2
Calidris alpina x ptilocnemis,Dunlin x Rock Sandpiper (hybrid),x01213,hybrid,6215.0,ROSA DUNL,CAPT CAAL,,Charadriiformes,Sandpipers and Allies,Scolopacidae,,,,scolop2
Calidris subruficollis x bairdii,Buff-breasted x Baird's Sandpiper (hybrid),x01123,hybrid,6218.0,BBSA BASA,CABA CASU,,Charadriiformes,Sandpipers and Allies,Scolopacidae,,,,scolop2
Arenaria interpres x Calidris fuscicollis,Ruddy Turnstone x White-rumped Sandpiper (hybrid),x01062,hybrid,6222.0,WRSA RUTU,ARIN CAFU,,Charadriiformes,Sandpipers and Allies,Scolopacidae,,,,scolop2
Calidris canutus x fuscicollis,Red Knot x White-rumped Sandpiper (hybrid),x01229,hybrid,6223.0,REKN WRSA,CAFU CACA,,Charadriiformes,Sandpipers and Allies,Scolopacidae,,,,scolop2
Calidris subruficollis x fuscicollis,Buff-breasted x White-rumped Sandpiper (hybrid),x00431,hybrid,6224.0,WRSA BBSA,CAFU CASU,,Charadriiformes,Sandpipers and Allies,Scolopacidae,,,,scolop2
Calidris alpina x fuscicollis,Dunlin x White-rumped Sandpiper (hybrid),x00430,hybrid,6225.0,WRSA DUNL,CAAL CAFU,,Charadriiformes,Sandpipers and Allies,Scolopacidae,,,,scolop2
Calidris ferruginea x melanotos,Curlew x Pectoral Sandpiper (hybrid),x00432,hybrid,6228.0,PESA CUSA,CAME CAFE,,Charadriiformes,Sandpipers and Allies,Scolopacidae,,,,scolop2
Calidris fuscicollis x melanotos,White-rumped x Pectoral Sandpiper (hybrid),x01094,hybrid,6229.0,WRSA PESA,CAME CAFU,,Charadriiformes,Sandpipers and Allies,Scolopacidae,,,,scolop2
Calidris fuscicollis x pusilla,White-rumped x Semipalmated Sandpiper (hybrid),x01042,hybrid,6233.0,WRSA SESA,CAPU CAFU,,Charadriiformes,Sandpipers and Allies,Scolopacidae,,,,scolop2
Uria lomvia x aalge,Thick-billed x Common Murre (hybrid),x00793,hybrid,6430.0,TBMU BRGU COMU COGU,URAA URLO,,Charadriiformes,"Auks, Murres, and Puffins",Alcidae,,,,alcida1
Chroicocephalus genei x ridibundus,Slender-billed x Black-headed Gull (hybrid),x00391,hybrid,6475.0,BHGU SBGU,CHGE CHRI,,Charadriiformes,"Gulls, Terns, and Skimmers",Laridae,,,,larida1
Chroicocephalus genei x brunnicephalus,Slender-billed x Brown-headed Gull (hybrid),x00734,hybrid,6478.0,SBGU BHGU,CHGE CHBR,,Charadriiformes,"Gulls, Terns, and Skimmers",Laridae,,,,larida1
Chroicocephalus cirrocephalus x hartlaubii,Gray-hooded x Hartlaub's Gull (hybrid),x00886,hybrid,6485.0,HAGU GHGU,CHCI CHHA,,Charadriiformes,"Gulls, Terns, and Skimmers",Laridae,,,,larida1
Chroicocephalus cirrocephalus x Leucophaeus atricilla,Gray-hooded x Laughing Gull (hybrid),x00392,hybrid,6493.0,LAGU GHGU,CHCI LEAT,,Charadriiformes,"Gulls, Terns, and Skimmers",Laridae,,,,larida1
Chroicocephalus philadelphia x Leucophaeus pipixcan,Bonaparte's x Franklin's Gull (hybrid),x00794,hybrid,6495.0,BOGU FRGU,LEPI CHPH,,Charadriiformes,"Gulls, Terns, and Skimmers",Laridae,,,,larida1
Chroicocephalus ridibundus x Ichthyaetus melanocephalus,Black-headed x Mediterranean Gull (hybrid),x00695,hybrid,6502.0,MEGU BHGU,ICME CHRI,,Charadriiformes,"Gulls, Terns, and Skimmers",Laridae,,,,larida1
Chroicocephalus ridibundus x Larus canus,Black-headed x Common Gull (hybrid),x00393,hybrid,6517.0,COGU MEGU BHGU,LACA CHRI,,Charadriiformes,"Gulls, Terns, and Skimmers",Laridae,,,,larida1
Ichthyaetus melanocephalus x Larus canus,Mediterranean x Common Gull (hybrid),x00847,hybrid,6518.0,COGU MEGU,ICME LACA,,Charadriiformes,"Gulls, Terns, and Skimmers",Laridae,,,,larida1
Chroicocephalus ridibundus x Larus delawarensis,Black-headed x Ring-billed Gull (hybrid),x00641,hybrid,6522.0,RBGU BHGU,LADE CHRI,,Charadriiformes,"Gulls, Terns, and Skimmers",Laridae,,,,larida1
Leucophaeus atricilla x Larus delawarensis,Laughing x Ring-billed Gull (hybrid),x00616,hybrid,6523.0,LAGU RBGU,LADE LEAT,,Charadriiformes,"Gulls, Terns, and Skimmers",Laridae,,,,larida1
Leucophaeus pipixcan x Larus delawarensis,Franklin's x Ring-billed Gull (hybrid),x00795,hybrid,6524.0,RBGU FRGU,LEPI LADE,,Charadriiformes,"Gulls, Terns, and Skimmers",Laridae,,,,larida1
Larus canus x delawarensis,Common x Ring-billed Gull (hybrid),x00394,hybrid,6525.0,RBGU COGU MEGU,LACA LADE,,Charadriiformes,"Gulls, Terns, and Skimmers",Laridae,,,,larida1
Larus brachyrhynchus x delawarensis,Short-billed x Ring-billed Gull (hybrid),x01230,hybrid,6526.0,RBGU MEGU SBIG SBGU,LADE LABR,,Charadriiformes,"Gulls, Terns, and Skimmers",Laridae,,,,larida1
Larus delawarensis x smithsonianus,Ring-billed x American Herring Gull (hybrid),x00796,hybrid,6540.0,RBGU AHGU,LASM LADE,,Charadriiformes,"Gulls, Terns, and Skimmers",Laridae,,,,larida1
Larus cachinnans x argentatus,Caspian x European Herring Gull (hybrid),x00915,hybrid,6548.0,EHGU CAGU,LACA LAAR,,Charadriiformes,"Gulls, Terns, and Skimmers",Laridae,,,,larida1
Larus dominicanus x smithsonianus,Kelp x American Herring Gull (hybrid),kxhgul1,hybrid,6549.0,SBBG AHGU KEGU,LASM LADO,,Charadriiformes,"Gulls, Terns, and Skimmers",Laridae,,,,larida1
Larus cachinnans x michahellis,Caspian x Yellow-legged Gull (hybrid),x00395,hybrid,6555.0,YLGU CAGU,LACA LAMI,,Charadriiformes,"Gulls, Terns, and Skimmers",Laridae,,,,larida1
Larus argentatus x michahellis,European Herring x Yellow-legged Gull (hybrid),x01182,hybrid,6556.0,YLGU EHGU,LAAR LAMI,,Charadriiformes,"Gulls, Terns, and Skimmers",Laridae,,,,larida1
Larus smithsonianus x marinus,American Herring x Great Black-backed Gull (hybrid),x00047,hybrid,6563.0,GBBG AHGU,LASM LAMA,,Charadriiformes,"Gulls, Terns, and Skimmers",Laridae,,,,larida1
Larus argentatus x marinus,European Herring x Great Black-backed Gull (hybrid),x01130,hybrid,6564.0,GBBG EHGU,LAAR LAMA,,Charadriiformes,"Gulls, Terns, and Skimmers",Laridae,,,,larida1
Larus michahellis x marinus,Yellow-legged x Great Black-backed Gull (hybrid),x00397,hybrid,6565.0,YLGU GBBG,LAMA LAMI,,Charadriiformes,"Gulls, Terns, and Skimmers",Laridae,,,,larida1
Larus smithsonianus x hyperboreus,American Herring x Glaucous Gull (hybrid),x01131,hybrid,6571.0,GLGU AHGU,LASM LAHY,,Charadriiformes,"Gulls, Terns, and Skimmers",Laridae,,,,larida1
Larus vegae x hyperboreus,Vega x Glaucous Gull (hybrid),x01132,hybrid,6572.0,VEGU GLGU AHGU,LAHY LAVE,,Charadriiformes,"Gulls, Terns, and Skimmers",Laridae,,,,larida1
Larus argentatus x hyperboreus,European Herring x Glaucous Gull (hybrid),x01133,hybrid,6573.0,EHGU GLGU,LAHY LAAR,,Charadriiformes,"Gulls, Terns, and Skimmers",Laridae,,,,larida1
Larus smithsonianus/vegae/argentatus x hyperboreus,American Herring/Vega/European Herring x Glaucous Gull (hybrid),nelgul,hybrid,6574.0,EHGU GLGU AHGU VEGU,LASM LAHY LAAR LAVE,,Charadriiformes,"Gulls, Terns, and Skimmers",Laridae,,,,larida1
Larus marinus x hyperboreus,Great Black-backed x Glaucous Gull (hybrid),x00632,hybrid,6575.0,GBBG GLGU,LAHY LAMA,,Charadriiformes,"Gulls, Terns, and Skimmers",Laridae,,,,larida1
Larus canus x fuscus,Common x Lesser Black-backed Gull (hybrid),x01231,hybrid,6584.0,LBBG COGU MEGU,LACA LAFU,,Charadriiformes,"Gulls, Terns, and Skimmers",Laridae,,,,larida1
Larus delawarensis x fuscus,Ring-billed x Lesser Black-backed Gull (hybrid),x01008,hybrid,6585.0,LBBG RBGU,LADE LAFU,,Charadriiformes,"Gulls, Terns, and Skimmers",Laridae,,,,larida1
Larus smithsonianus x fuscus,American Herring x Lesser Black-backed Gull (hybrid),x01134,hybrid,6586.0,LBBG AHGU,LASM LAFU,,Charadriiformes,"Gulls, Terns, and Skimmers",Laridae,,,,larida1
Larus argentatus x fuscus,European Herring x Lesser Black-backed Gull (hybrid),x00057,hybrid,6587.0,LBBG EHGU,LAAR LAFU,,Charadriiformes,"Gulls, Terns, and Skimmers",Laridae,,,,larida1
Larus michahellis x fuscus,Yellow-legged x Lesser Black-backed Gull (hybrid),x00396,hybrid,6588.0,YLGU LBBG,LAMI LAFU,,Charadriiformes,"Gulls, Terns, and Skimmers",Laridae,,,,larida1
Larus delawarensis x californicus,Ring-billed x California Gull (hybrid),x01183,hybrid,6594.0,RBGU CAGU,LACA LADE,,Charadriiformes,"Gulls, Terns, and Skimmers",Laridae,,,,larida1
Larus smithsonianus x californicus,American Herring x California Gull (hybrid),x00797,hybrid,6595.0,CAGU AHGU,LACA LASM,,Charadriiformes,"Gulls, Terns, and Skimmers",Laridae,,,,larida1
Larus occidentalis x glaucescens,Western x Glaucous-winged Gull (hybrid),x00051,hybrid,6597.0,WEGU GWGU,LAGL LAOC,WGWH,Charadriiformes,"Gulls, Terns, and Skimmers",Laridae,,,,larida1
Larus smithsonianus x glaucescens,American Herring x Glaucous-winged Gull (hybrid),x00050,hybrid,6598.0,AHGU GWGU,LASM LAGL,,Charadriiformes,"Gulls, Terns, and Skimmers",Laridae,,,,larida1
Larus hyperboreus x glaucescens,Glaucous x Glaucous-winged Gull (hybrid),x00048,hybrid,6599.0,GLGU GWGU,LAGL LAHY,,Charadriiformes,"Gulls, Terns, and Skimmers",Laridae,,,,larida1
Larus vegae x schistisagus,Vega x Slaty-backed Gull (hybrid),x00434,hybrid,6603.0,SBGU SBAG AHGU VEGU,LASC LAVE,,Charadriiformes,"Gulls, Terns, and Skimmers",Laridae,,,,larida1
Larus glaucescens x schistisagus,Glaucous-winged x Slaty-backed Gull (hybrid),x00436,hybrid,6604.0,SBAG SBGU GWGU,LAGL LASC,,Charadriiformes,"Gulls, Terns, and Skimmers",Laridae,,,,larida1
Larus hyperboreus x schistisagus,Glaucous x Slaty-backed Gull (hybrid),x00437,hybrid,6605.0,GLGU SBGU SBAG,LAHY LASC,,Charadriiformes,"Gulls, Terns, and Skimmers",Laridae,,,,larida1
Larus smithsonianus x glaucoides,American Herring x Iceland Gull (hybrid),x00617,hybrid,6613.0,ICGU AHGU,LASM LAGL,,Charadriiformes,"Gulls, Terns, and Skimmers",Laridae,,,,larida1
Larus fuscus x glaucoides,Lesser Black-backed x Iceland Gull (hybrid),x01232,hybrid,6614.0,LBBG ICGU,LAGL LAFU,,Charadriiformes,"Gulls, Terns, and Skimmers",Laridae,,,,larida1
Gygis candida x microrhyncha,Blue-billed x Little White-Tern (hybrid),x01184,hybrid,6631.0,LIWT WHTE CWTE BBWT LWTE,GYCA GYMI,,Charadriiformes,"Gulls, Terns, and Skimmers",Laridae,,,,larida1
Sternula albifrons x nereis,Little x Australian Fairy Tern (hybrid),x00798,hybrid,6697.0,AFTE FATE LITE,STNE STAL,,Charadriiformes,"Gulls, Terns, and Skimmers",Laridae,,,,larida1
Sterna forsteri x paradisaea,Forster's x Arctic Tern (hybrid),x01165,hybrid,6734.0,ARTE FOTE,STFO STPA,,Charadriiformes,"Gulls, Terns, and Skimmers",Laridae,,,,larida1
Sterna hirundo x paradisaea,Common x Arctic Tern (hybrid),x00910,hybrid,6754.0,ARTE COTE,STHI STPA,,Charadriiformes,"Gulls, Terns, and Skimmers",Laridae,,,,larida1
Sterna hirundo x dougallii,Common x Roseate Tern (hybrid),x00735,hybrid,6767.0,ROTE ROST COTE,STHI STDO,,Charadriiformes,"Gulls, Terns, and Skimmers",Laridae,,,,larida1
Thalasseus sandvicensis x elegans,Sandwich x Elegant Tern (hybrid),x00438,hybrid,6781.0,ELTE SATE,THEL THSA,,Charadriiformes,"Gulls, Terns, and Skimmers",Laridae,,,,larida1
Thalasseus sandvicensis x bengalensis,Sandwich x Lesser Crested Tern (hybrid),x01233,hybrid,6787.0,SATE LCTE,THBE THSA,,Charadriiformes,"Gulls, Terns, and Skimmers",Laridae,,,,larida1
Thalasseus bengalensis x bergii,Lesser x Great Crested Tern (hybrid),x01040,hybrid,6797.0,SWTE LCTE GCTE SWIF CRTE,THBE,,Charadriiformes,"Gulls, Terns, and Skimmers",Laridae,,,,larida1
Thalasseus bergii x bernsteini,Great x Chinese Crested Tern (hybrid),x00848,hybrid,6800.0,SWTE GCTE CCTE SWIF CRTE,THBE,,Charadriiformes,"Gulls, Terns, and Skimmers",Laridae,,,,larida1
Phoenicopterus chilensis x ruber,Chilean x American Flamingo (hybrid),x01038,hybrid,6810.0,CHFL AMFL,PHCH PHRU,,Phoenicopteriformes,Flamingos,Phoenicopteridae,,,,phoeni1
Phoenicopterus chilensis x roseus,Chilean x Greater Flamingo (hybrid),x01039,hybrid,6812.0,CHFL GRFL,PHCH PHRO,,Phoenicopteriformes,Flamingos,Phoenicopteridae,,,,phoeni1
Phoenicopterus ruber x roseus,American x Greater Flamingo (hybrid),x01185,hybrid,6813.0,AMFL GRFL,PHRO PHRU,,Phoenicopteriformes,Flamingos,Phoenicopteridae,,,,phoeni1
Aechmophorus occidentalis x clarkii,Western x Clark's Grebe (hybrid),x00427,hybrid,6894.0,WEGR CLGR,AEOC AECL,,Podicipediformes,Grebes,Podicipedidae,,,,podici1
Gavia immer x adamsii,Common x Yellow-billed Loon (hybrid),x01146,hybrid,6935.0,COLO WBDI YBLO GNDI,GAAD GAIM,,Gaviiformes,Loons,Gaviidae,,,,gaviid1
Spheniscus humboldti x magellanicus,Humboldt x Magellanic Penguin (hybrid),x01082,hybrid,6960.0,HUPE MAPE,SPHU SPMA,,Sphenisciformes,Penguins,Spheniscidae,,,,spheni1
Eudyptes chrysolophus x chrysocome,Macaroni x Western Rockhopper Penguin (hybrid),x00921,hybrid,6967.0,WRPE SRPE MAPE,EUCH,,Sphenisciformes,Penguins,Spheniscidae,,,,spheni1
Phoebastria immutabilis x nigripes,Laysan x Black-footed Albatross (hybrid),x00017,hybrid,6989.0,BFAL LAAL,PHIM PHNI,LBFH,Procellariiformes,Albatrosses,Diomedeidae,,,,diomed1
Thalassarche chrysostoma x melanophris,Gray-headed x Black-browed Albatross (hybrid),x01063,hybrid,7009.0,GHMO BBAL BBMO GHAL,THCH THME,,Procellariiformes,Albatrosses,Diomedeidae,,,,diomed1
Ciconia nigra x ciconia,Black x White Stork (hybrid),x01098,hybrid,7294.0,BLST WHST,CINI CICI,,Ciconiiformes,Storks,Ciconiidae,,,,ciconi2
Mycteria cinerea x leucocephala,Milky x Painted Stork (hybrid),x00729,hybrid,7310.0,MIST PAST,MYLE MYCI,,Ciconiiformes,Storks,Ciconiidae,,,,ciconi2
Morus capensis x serrator,Cape x Australasian Gannet (hybrid),x01234,hybrid,7336.0,AUGA CAGA,MOCA MOSE,,Suliformes,Boobies and Gannets,Sulidae,,,,sulida1
Sula leucogaster x dactylatra,Brown x Masked Booby (hybrid),x00782,hybrid,7354.0,MABO BRBO,SUDA SULE,,Suliformes,Boobies and Gannets,Sulidae,,,,sulida1
Sula dactylatra x granti,Masked x Nazca Booby (hybrid),x01064,hybrid,7356.0,NABO MABO,SUDA SUGR,,Suliformes,Boobies and Gannets,Sulidae,,,,sulida1
Sula brewsteri x nebouxii,Cocos x Blue-footed Booby (hybrid),x00950,hybrid,7361.0,BFBO COBO BRBO,SUBR SUNE,,Suliformes,Boobies and Gannets,Sulidae,,,,sulida1
Sula nebouxii x variegata,Blue-footed x Peruvian Booby (hybrid),x01065,hybrid,7363.0,BFBO PEBO,SUNE SUVA,,Suliformes,Boobies and Gannets,Sulidae,,,,sulida1
Nannopterum auritum x brasilianum,Double-crested x Neotropic Cormorant (hybrid),x00783,hybrid,7434.0,DCCO NECO,NABR NAAU,,Suliformes,Cormorants and Shags,Phalacrocoracidae,,,,phalac1
Leucocarbo bougainvilliorum x atriceps,Guanay x Imperial Cormorant (hybrid),x01186,hybrid,7458.0,IMCO IMSH GUCO ICSP,LEBO LEAT,,Suliformes,Cormorants and Shags,Phalacrocoracidae,,,,phalac1
Eudocimus albus x ruber,White x Scarlet Ibis (hybrid),x00428,hybrid,7466.0,AWIB WHIB SCIB,EURU EUAL,,Pelecaniformes,Ibises and Spoonbills,Threskiornithidae,,,,thresk1
Plegadis falcinellus x chihi,Glossy x White-faced Ibis (hybrid),gxwibi1,hybrid,7469.0,WFIB GLIB,PLCH PLFA,,Pelecaniformes,Ibises and Spoonbills,Threskiornithidae,,,,thresk1
Threskiornis molucca x spinicollis,Australian x Straw-necked Ibis (hybrid),x01157,hybrid,7502.0,AWIB SNIB WHIB AUIB,THMO THSP,,Pelecaniformes,Ibises and Spoonbills,Threskiornithidae,,,,thresk1
Platalea leucorodia x minor,Eurasian x Black-faced Spoonbill (hybrid),x00883,hybrid,7531.0,ESPO EUSP BFSP,PLLE PLMI,,Pelecaniformes,Ibises and Spoonbills,Threskiornithidae,,,,thresk1
Nyctanassa violacea x Nycticorax nycticorax,Yellow-crowned x Black-crowned Night Heron (hybrid),x00704,hybrid,7605.0,BCNH YCNH,NYNY NYVI,,Pelecaniformes,"Herons, Egrets, and Bitterns",Ardeidae,,,,ardeid1
Nycticorax nycticorax x caledonicus,Black-crowned x Nankeen Night Heron (hybrid),x01041,hybrid,7617.0,BCNH NNHE,NYCA NYNY,,Pelecaniformes,"Herons, Egrets, and Bitterns",Ardeidae,,,,ardeid1
Egretta caerulea x tricolor,Little Blue x Tricolored Heron (hybrid),x00696,hybrid,7633.0,LBHE TRHE,EGCA EGTR,,Pelecaniformes,"Herons, Egrets, and Bitterns",Ardeidae,,,,ardeid1
Egretta tricolor x rufescens,Tricolored Heron x Reddish Egret (hybrid),x00785,hybrid,7637.0,TRHE REEG,EGTR EGRU,,Pelecaniformes,"Herons, Egrets, and Bitterns",Ardeidae,,,,ardeid1
Egretta caerulea x thula,Little Blue Heron x Snowy Egret (hybrid),x00615,hybrid,7648.0,LBHE SNEG,EGCA EGTH,,Pelecaniformes,"Herons, Egrets, and Bitterns",Ardeidae,,,,ardeid1
Egretta tricolor x thula,Tricolored Heron x Snowy Egret (hybrid),x00730,hybrid,7649.0,TRHE SNEG,EGTR EGTH,,Pelecaniformes,"Herons, Egrets, and Bitterns",Ardeidae,,,,ardeid1
Egretta thula x garzetta,Snowy x Little Egret (hybrid),x00697,hybrid,7654.0,LIEG SNEG LEWR,EGGA EGTH,,Pelecaniformes,"Herons, Egrets, and Bitterns",Ardeidae,,,,ardeid1
Egretta garzetta x gularis,Little Egret x Western Reef-Heron (hybrid),x00656,hybrid,7658.0,WRHE WERH LIEG WREG LEWR,EGGU EGGA,,Pelecaniformes,"Herons, Egrets, and Bitterns",Ardeidae,,,,ardeid1
Butorides striata x sundevalli,Striated x Lava Heron (hybrid),x01187,hybrid,7671.0,STHE STRH LAHE GBHE SASH,BUSU BUST,,Pelecaniformes,"Herons, Egrets, and Bitterns",Ardeidae,,,,ardeid1
Butorides striata x virescens,Striated x Green Heron (hybrid),x00765,hybrid,7710.0,STHE NAGH STRH GBHE GRHE SASH,BUVI BUST,,Pelecaniformes,"Herons, Egrets, and Bitterns",Ardeidae,,,,ardeid1
Ardeola grayii x bacchus,Indian x Chinese Pond-Heron (hybrid),x01124,hybrid,7718.0,CHPH CPHE IPHE INPH,ARBA ARGR,,Pelecaniformes,"Herons, Egrets, and Bitterns",Ardeidae,,,,ardeid1
Ardeola bacchus x speciosa,Chinese x Javan Pond-Heron (hybrid),x01125,hybrid,7722.0,JPHE CHPH JAPH CPHE,ARSP ARBA,,Pelecaniformes,"Herons, Egrets, and Bitterns",Ardeidae,,,,ardeid1
Egretta garzetta x Ardea ibis,Little Egret x Western Cattle-Egret (hybrid),x01188,hybrid,7725.0,WECE LIEG WCEG LEWR CAEG,ARIB EGGA,,Pelecaniformes,"Herons, Egrets, and Bitterns",Ardeidae,,,,ardeid1
Egretta garzetta x Ardea cinerea,Little Egret x Gray Heron (hybrid),x01189,hybrid,7751.0,GRHE GRAH LIEG LEWR,EGGA ARCI,,Pelecaniformes,"Herons, Egrets, and Bitterns",Ardeidae,,,,ardeid1
Ardea alba x cinerea,Great Egret x Gray Heron (hybrid),x00398,hybrid,7752.0,GRHE GRAH GWEG GREG WHHE,ARCI ARAL,,Pelecaniformes,"Herons, Egrets, and Bitterns",Ardeidae,,,,ardeid1
Ardea alba x herodias,Great Egret x Great Blue Heron (hybrid),x00677,hybrid,7761.0,GBHE GWEG GREG GBWH WHHE,ARHE ARAL,,Pelecaniformes,"Herons, Egrets, and Bitterns",Ardeidae,,,,ardeid1
Ardea alba x cocoi,Great Egret x Cocoi Heron (hybrid),x01051,hybrid,7763.0,GWEG GREG WHHE COHE,ARAL ARCO,,Pelecaniformes,"Herons, Egrets, and Bitterns",Ardeidae,,,,ardeid1
Ardea herodias x cocoi,Great Blue x Cocoi Heron (hybrid),x00784,hybrid,7764.0,GBHE GBWH COHE,ARHE ARCO,,Pelecaniformes,"Herons, Egrets, and Bitterns",Ardeidae,,,,ardeid1
Ardea cinerea x purpurea,Gray x Purple Heron (hybrid),x01050,hybrid,7772.0,GRHE GRAH PUHE,ARPU ARCI,,Pelecaniformes,"Herons, Egrets, and Bitterns",Ardeidae,,,,ardeid1
Pelecanus onocrotalus x crispus,Great White x Dalmatian Pelican (hybrid),x00842,hybrid,7805.0,GWPE DAPE,PEON PECR,,Pelecaniformes,Pelicans,Pelecanidae,,,,peleca1
Pernis apivorus x ptilorhynchus,European x Oriental Honey-buzzard (hybrid),x00786,hybrid,7915.0,ORHB OHBU EUHB CRHB EHBU CHBU,PEPT PEAP,,Accipitriformes,"Hawks, Eagles, and Kites",Accipitridae,,,,accipi1
Clanga pomarina x clanga,Lesser x Greater Spotted Eagle (hybrid),x00843,hybrid,8041.0,LSEA GSEA,CLCL CLPO,,Accipitriformes,"Hawks, Eagles, and Kites",Accipitridae,,,,accipi1
Astur cooperii x atricapillus,Cooper's Hawk x American Goshawk (hybrid),x00988,hybrid,8296.0,COHA AMGO AGOS NOGO,ASCO ASAT,,Accipitriformes,"Hawks, Eagles, and Kites",Accipitridae,,,,accipi1
Circus cyaneus x macrourus,Hen x Pallid Harrier (hybrid),x00399,hybrid,8327.0,PAHA HEHA,CIMA CICY,,Accipitriformes,"Hawks, Eagles, and Kites",Accipitridae,,,,accipi1
Circus macrourus x pygargus,Pallid x Montagu's Harrier (hybrid),x01099,hybrid,8330.0,MOHA PAHA,CIPY CIMA,,Accipitriformes,"Hawks, Eagles, and Kites",Accipitridae,,,,accipi1
Haliaeetus leucocephalus x pelagicus,Bald Eagle x Steller's Sea-Eagle (hybrid),x00989,hybrid,8372.0,STSE BAEA SSEA,HAPE HALE,,Accipitriformes,"Hawks, Eagles, and Kites",Accipitridae,,,,accipi1
Buteogallus anthracinus x Buteo lineatus,Common Black x Red-shouldered Hawk (hybrid),x00787,hybrid,8494.0,RSHA COBH CBHA,BUAN BULI,,Accipitriformes,"Hawks, Eagles, and Kites",Accipitridae,,,,accipi1
Buteo platypterus x lineatus,Broad-winged x Red-shouldered Hawk (hybrid),x00400,hybrid,8496.0,RSHA BWHA,BUPL BULI,,Accipitriformes,"Hawks, Eagles, and Kites",Accipitridae,,,,accipi1
Buteo lineatus x jamaicensis,Red-shouldered x Red-tailed Hawk (hybrid),x00686,hybrid,8526.0,RSHA RTHA,BUJA BULI,,Accipitriformes,"Hawks, Eagles, and Kites",Accipitridae,,,,accipi1
Buteo swainsoni x lagopus,Swainson's x Rough-legged Hawk (hybrid),x00788,hybrid,8533.0,RLHA SWHA RLBU,BUSW BULA,,Accipitriformes,"Hawks, Eagles, and Kites",Accipitridae,,,,accipi1
Buteo jamaicensis x lagopus,Red-tailed x Rough-legged Hawk (hybrid),x00731,hybrid,8534.0,RLHA RTHA RLBU,BUJA BULA,,Accipitriformes,"Hawks, Eagles, and Kites",Accipitridae,,,,accipi1
Buteo jamaicensis x regalis,Red-tailed x Ferruginous Hawk (hybrid),x00930,hybrid,8536.0,FEHA RTHA,BUJA BURE,,Accipitriformes,"Hawks, Eagles, and Kites",Accipitridae,,,,accipi1
Buteo buteo x rufinus,Common x Long-legged Buzzard (hybrid),x00766,hybrid,8559.0,LLBU COBU EUBU,BURU BUBU,,Accipitriformes,"Hawks, Eagles, and Kites",Accipitridae,,,,accipi1
Buteo rufinus x hemilasius,Long-legged x Upland Buzzard (hybrid),x00789,hybrid,8562.0,LLBU UPBU,BURU BUHE,,Accipitriformes,"Hawks, Eagles, and Kites",Accipitridae,,,,accipi1
Megascops kennicottii x asio,Western x Eastern Screech-Owl (hybrid),x00933,hybrid,8874.0,EASO WESO WSOW ESOW,MEKE MEAS,,Strigiformes,Owls,Strigidae,,,,strigi1
Ketupa ketupu x zeylonensis,Buffy x Brown Fish-Owl (hybrid),x00401,hybrid,8982.0,BRFO BUFO BFOW,KEZE KEKE,,Strigiformes,Owls,Strigidae,,,,strigi1
Strix occidentalis x varia,Spotted x Barred Owl (hybrid),x00439,hybrid,9223.0,BAOW SPOW,STVA STOC,SBOH,Strigiformes,Owls,Strigidae,,,,strigi1
Pharomachrus auriceps x antisianus,Golden-headed x Crested Quetzal (hybrid),x01126,hybrid,9515.0,GHQU CRQU,PHAN PHAU,,Trogoniformes,Trogons,Trogonidae,,,,trogon1
Trogon curucui x surrucura,Blue-crowned x Surucua Trogon (hybrid),x01156,hybrid,9559.0,BCTR SSTR SUTR,TRSU TRCU,,Trogoniformes,Trogons,Trogonidae,,,,trogon1
Tockus rufirostris x damarensis,Southern x Damara Red-billed Hornbill (hybrid),x00667,hybrid,9680.0,DRBH RBHO SRBH,TORU TODA,,Bucerotiformes,Hornbills,Bucerotidae,,,,bucero1
Momotus coeruliceps x lessonii,Blue-capped x Lesson's Motmot (hybrid),x00887,hybrid,9861.0,LEMO BCMO BDMO,MOCO MOLE,,Coraciiformes,Motmots,Momotidae,,,,momoti1
Momotus lessonii x Baryphthengus martii,Lesson's x Rufous Motmot (hybrid),x01211,hybrid,9886.0,LEMO RUMO BDMO RMOT,BAMA MOLE,,Coraciiformes,Motmots,Momotidae,,,,momoti1
Momotus momota x Baryphthengus martii,Amazonian x Rufous Motmot (hybrid),x00402,hybrid,9887.0,AMMO RMOT RUMO,MOMO BAMA,,Coraciiformes,Motmots,Momotidae,,,,momoti1
Momotus momota x Baryphthengus ruficapillus,Amazonian x Rufous-capped Motmot (hybrid),x00769,hybrid,9889.0,AMMO RCMO,MOMO BARU,,Coraciiformes,Motmots,Momotidae,,,,momoti1
Coracias benghalensis x affinis,Indian x Indochinese Roller (hybrid),indrol4,hybrid,10344.0,INRO,COBE COAF,,Coraciiformes,Rollers,Coraciidae,,,,coraci1
Hypnelus ruficollis x bicinctus,Russet-throated x Two-banded Puffbird (hybrid),x01190,hybrid,10414.0,TBPU RTPU,HYRU HYBI,,Piciformes,Puffbirds,Bucconidae,,,,buccon2
Tricholaema frontata x leucomelas,Miombo x Pied Barbet (hybrid),x01009,hybrid,10636.0,APBA PIBA MPBA MIBA,TRLE TRFR,,Piciformes,African Barbets,Lybiidae,,,,lybiid1
Psilopogon cyanotis x duvaucelii,Blue-eared x Black-eared Barbet (hybrid),x01066,hybrid,10714.0,BEBA,PSCY PSDU,,Piciformes,Asian Barbets,Megalaimidae,,,,megala2
Pteroglossus torquatus x erythropygius,Collared x Pale-mandibled Aracari (hybrid),x01191,hybrid,10892.0,PMBA COAR PMAR,PTER PTTO,,Piciformes,Toucans,Ramphastidae,,,,rampha1
Picumnus minutissimus x cirratus,Arrowhead x White-barred Piculet (hybrid),x01192,hybrid,11054.0,ARPI WBPI,PIMI PICI,,Piciformes,Woodpeckers,Picidae,,,,picida1
Picumnus cirratus x temminckii,White-barred x Ochre-collared Piculet (hybrid),x00951,hybrid,11072.0,WBPI OCPI,PICI PITE,,Piciformes,Woodpeckers,Picidae,,,,picida1
Picumnus cirratus x albosquamatus,White-barred x White-wedged Piculet (hybrid),x00952,hybrid,11077.0,WBPI WWPI,PIAL PICI,,Piciformes,Woodpeckers,Picidae,,,,picida1
Sphyrapicus varius x nuchalis,Yellow-bellied x Red-naped Sapsucker (hybrid),x00634,hybrid,11128.0,RNSA YBSA,SPNU SPVA,,Piciformes,Woodpeckers,Picidae,,,,picida1
Sphyrapicus varius x ruber,Yellow-bellied x Red-breasted Sapsucker (hybrid),x00712,hybrid,11133.0,RBSA YBSA,SPRU SPVA,,Piciformes,Woodpeckers,Picidae,,,,picida1
Sphyrapicus nuchalis x ruber,Red-naped x Red-breasted Sapsucker (hybrid),rnxsap1,hybrid,11134.0,RNSA RBSA,SPNU SPRU,,Piciformes,Woodpeckers,Picidae,,,,picida1
Sphyrapicus varius/nuchalis x ruber,Yellow-bellied/Red-naped x Red-breasted Sapsucker (hybrid),x01052,hybrid,11135.0,RNSA RBSA YBSA,SPVA SPNU SPRU,,Piciformes,Woodpeckers,Picidae,,,,picida1
Melanerpes pucherani x hoffmannii,Black-cheeked x Hoffmann's Woodpecker (hybrid),x01212,hybrid,11181.0,BCWO HOWO,MEPU MEHO,,Piciformes,Woodpeckers,Picidae,,,,picida1
Melanerpes rubricapillus x hoffmannii,Red-crowned x Hoffmann's Woodpecker (hybrid),x00440,hybrid,11182.0,RCRW HOWO RCWO,MEHO MERU,,Piciformes,Woodpeckers,Picidae,,,,picida1
Melanerpes hoffmannii x aurifrons,Hoffmann's x Golden-fronted Woodpecker (hybrid),x00853,hybrid,11197.0,GFWO HOWO,MEAU MEHO,,Piciformes,Woodpeckers,Picidae,,,,picida1
Melanerpes aurifrons x carolinus,Golden-fronted x Red-bellied Woodpecker (hybrid),x00460,hybrid,11200.0,RBWO GFWO,MEAU MECA,,Piciformes,Woodpeckers,Picidae,,,,picida1
Dendrocopos major x syriacus,Great Spotted x Syrian Woodpecker (hybrid),x00914,hybrid,11373.0,SYWO GSWO,DESY DEMA,,Piciformes,Woodpeckers,Picidae,,,,picida1
Dryobates pubescens x nuttallii,Downy x Nuttall's Woodpecker (hybrid),x00662,hybrid,11411.0,NUWO DOWO,DRNU DRPU,,Piciformes,Woodpeckers,Picidae,,,,picida1
