SCIENTIFIC_NAME,COMMON_NAME,SPECIES_CODE,CATEGORY,TAXON_ORDER,COM_NAME_CODES,SCI_NAME_CODES,BANDING_CODES,ORDER,FAMILY_COM_NAME,FAMILY_SCI_NAME,REPORT_AS,EXTINCT,EXTINCT_YEAR,FAMILY_CODE
Zosterops pallidus x virens,Orange River x Cape White-eye (hybrid),x00968,hybrid,25706.0,ORWE CWEY CAWE,ZOPA ZOVI,,Passeriformes,"White-eyes, Yuhinas, and Allies",Zosteropidae,,,,zoster2
Zosterops citrinella x lateralis,Ashy-bellied White-eye x Silvereye (hybrid),x01127,hybrid,25789.0,ABWE SILV,ZOLA ZOCI,,Passeriformes,"White-eyes, Yuhinas, and Allies",Zosteropidae,,,,zoster2
Actinodura nipalensis x waldeni,Hoary-throated x Streak-throated Barwing (hybrid),x01198,hybrid,26533.0,HTBA STBA,ACWA ACNI,,Passeriformes,Laughingthrushes and Allies,Leiothrichidae,,,,leioth1
Garrulax canorus x taewanus,Chinese x Taiwan Hwamei (hybrid),x00816,hybrid,26718.0,HWAM CHHW TAHW,GACA GATA,,Passeriformes,Laughingthrushes and Allies,Leiothrichidae,,,,leioth1
Polioptila melanura x nigriceps,Black-tailed x Black-capped Gnatcatcher (hybrid),x00643,hybrid,27144.0,BTGN BCGN,POME PONI,,Passeriformes,Gnatcatchers,Polioptilidae,,,,poliop1
Troglodytes aedon x Thryothorus ludovicianus,Northern House x Carolina Wren (hybrid),x01068,hybrid,27361.0,NHWR HOWR CARW CBWR CAWR,TRAE THLU,,Passeriformes,Wrens,Troglodytidae,,,,troglo1
Campylorhynchus albobrunneus x zonatus,White-headed x Band-backed Wren (hybrid),x00969,hybrid,27394.0,BBWR WHWR BABW,CAZO CAAL,,Passeriformes,Wrens,Troglodytidae,,,,troglo1
Pheugopedius genibarbis x coraya,Moustached x Coraya Wren (hybrid),x00970,hybrid,27481.0,COWR MOWR,PHCO PHGE,,Passeriformes,Wrens,Troglodytidae,,,,troglo1
Buphagus erythroryncha x africanus,Red-billed x Yellow-billed Oxpecker (hybrid),x01244,hybrid,27684.0,RBOX YBOX,BUER BUAF,,Passeriformes,Oxpeckers,Buphagidae,,,,buphag1
Gracupica contra x Sturnia malabarica,Indian Pied x Chestnut-tailed Starling (hybrid),x01027,hybrid,27850.0,IPMY CTST IPST,GRCO STMA,,Passeriformes,Starlings,Sturnidae,,,,sturni1
Acridotheres burmannicus x fuscus,Burmese x Jungle Myna (hybrid),x01056,hybrid,27876.0,BUMY JUMY BUST,ACFU ACBU,,Passeriformes,Starlings,Sturnidae,,,,sturni1
Acridotheres fuscus x javanicus,Jungle x Javan Myna (hybrid),x01028,hybrid,27879.0,JUMY JAMY,ACJA ACFU,,Passeriformes,Starlings,Sturnidae,,,,sturni1
Gracupica nigricollis x Acridotheres grandis,Black-collared Starling x Great Myna (hybrid),x00468,hybrid,27883.0,BCST GRMY,GRNI ACGR,,Passeriformes,Starlings,Sturnidae,,,,sturni1
Gracupica floweri x Acridotheres grandis,Siamese Pied Starling x Great Myna (hybrid),x01136,hybrid,27884.0,SPST TPST GRMY SPMY,GRFL ACGR,,Passeriformes,Starlings,Sturnidae,,,,sturni1
Acridotheres tristis x grandis,Common x Great Myna (hybrid),x00469,hybrid,27885.0,GRMY COMY,ACTR ACGR,,Passeriformes,Starlings,Sturnidae,,,,sturni1
Acridotheres leucocephalus x grandis,Vinous-breasted x Great Myna (hybrid),x01160,hybrid,27886.0,VBMY VBST GRMY,ACLE ACGR,,Passeriformes,Starlings,Sturnidae,,,,sturni1
Acridotheres fuscus x grandis,Jungle x Great Myna (hybrid),x01029,hybrid,27887.0,JUMY GRMY,ACGR ACFU,,Passeriformes,Starlings,Sturnidae,,,,sturni1
Acridotheres javanicus x grandis,Javan x Great Myna (hybrid),x00893,hybrid,27888.0,JAMY GRMY,ACGR ACJA,,Passeriformes,Starlings,Sturnidae,,,,sturni1
Spodiopsar cineraceus x Acridotheres cristatellus,White-cheeked Starling x Crested Myna (hybrid),x01083,hybrid,27893.0,CRMY WCST,SPCI ACCR,,Passeriformes,Starlings,Sturnidae,,,,sturni1
Acridotheres tristis x cristatellus,Common x Crested Myna (hybrid),x01030,hybrid,27894.0,CRMY COMY,ACTR ACCR,,Passeriformes,Starlings,Sturnidae,,,,sturni1
Acridotheres albocinctus x cristatellus,Collared x Crested Myna (hybrid),x01031,hybrid,27895.0,CRMY COMY,ACCR ACAL,,Passeriformes,Starlings,Sturnidae,,,,sturni1
Toxostoma curvirostre x longirostre,Curve-billed x Long-billed Thrasher (hybrid),x00971,hybrid,28043.0,CBTH LBTH,TOLO TOCU,,Passeriformes,Mockingbirds and Thrashers,Mimidae,,,,mimida2
Toxostoma redivivum x crissale,California x Crissal Thrasher (hybrid),x00470,hybrid,28067.0,CRTH CATH,TORE TOCR,,Passeriformes,Mockingbirds and Thrashers,Mimidae,,,,mimida2
Mimus thenca x saturninus,Chilean x Chalk-browed Mockingbird (hybrid),x01245,hybrid,28077.0,CHMO CBMO,MITH MISA,,Passeriformes,Mockingbirds and Thrashers,Mimidae,,,,mimida2
Mimus gundlachii x polyglottos,Bahama x Northern Mockingbird (hybrid),x00907,hybrid,28118.0,BAMO NOMO,MIGU MIPO,,Passeriformes,Mockingbirds and Thrashers,Mimidae,,,,mimida2
Mimus gilvus x polyglottos,Tropical x Northern Mockingbird (hybrid),x00703,hybrid,28119.0,TRMO NOMO,MIGI MIPO,,Passeriformes,Mockingbirds and Thrashers,Mimidae,,,,mimida2
Sialia sialis x mexicana,Eastern x Western Bluebird (hybrid),x00972,hybrid,28143.0,WEBL EABL,SIME SISI,,Passeriformes,Thrushes and Allies,Turdidae,,,,turdid1
Sialia sialis x currucoides,Eastern x Mountain Bluebird (hybrid),x00864,hybrid,28145.0,MOBL EABL,SICU SISI,,Passeriformes,Thrushes and Allies,Turdidae,,,,turdid1
Sialia mexicana x currucoides,Western x Mountain Bluebird (hybrid),x00204,hybrid,28146.0,WEBL MOBL,SIME SICU,,Passeriformes,Thrushes and Allies,Turdidae,,,,turdid1
Catharus fuscescens x bicknelli,Veery x Bicknell's Thrush (hybrid),x00865,hybrid,28322.0,BITH VEER,CAFU CABI,,Passeriformes,Thrushes and Allies,Turdidae,,,,turdid1
Turdus olivaceus x smithi,Olive x Karoo Thrush (hybrid),x01034,hybrid,28495.0,OLTH KATH SAOT,TUSM TUOL,,Passeriformes,Thrushes and Allies,Turdidae,,,,turdid1
Turdus dissimilis x cardis,Black-breasted x Japanese Thrush (hybrid),x01043,hybrid,28512.0,JATH BBTH,TUCA TUDI,,Passeriformes,Thrushes and Allies,Turdidae,,,,turdid1
Turdus atrogularis x ruficollis,Black-throated x Red-throated Thrush (hybrid),x00644,hybrid,28604.0,RTTH BTTH,TUAT TURU,,Passeriformes,Thrushes and Allies,Turdidae,,,,turdid1
Turdus atrogularis x naumanni,Black-throated x Naumann's Thrush (hybrid),x01137,hybrid,28608.0,BTTH NATH,TUAT TUNA,,Passeriformes,Thrushes and Allies,Turdidae,,,,turdid1
Turdus ruficollis x naumanni,Red-throated x Naumann's Thrush (hybrid),x01199,hybrid,28609.0,RTTH NATH,TUNA TURU,,Passeriformes,Thrushes and Allies,Turdidae,,,,turdid1
Turdus eunomus x naumanni,Dusky x Naumann's Thrush (hybrid),x00973,hybrid,28610.0,DUTH NATH,TUEU TUNA,,Passeriformes,Thrushes and Allies,Turdidae,,,,turdid1
Cyornis poliogenys x tickelliae,Pale-chinned x Tickell's Blue Flycatcher (hybrid),x00927,hybrid,29155.0,PCFL TBFL,CYTI CYPO,,Passeriformes,Old World Flycatchers,Muscicapidae,,,,muscic3
Cossypha natalensis x dichroa,Red-capped x Chorister Robin-Chat (hybrid),x01214,hybrid,29236.0,RCRC CHRC CRCH,CONA CODI,,Passeriformes,Old World Flycatchers,Muscicapidae,,,,muscic3
Luscinia luscinia x megarhynchos,Thrush x Common Nightingale (hybrid),x01010,hybrid,29398.0,CONI THNI,LULU LUME,,Passeriformes,Old World Flycatchers,Muscicapidae,,,,muscic3
Ficedula semitorquata x hypoleuca,Semicollared x European Pied Flycatcher (hybrid),x00471,hybrid,29562.0,SCFL EPFL PIFL SEFL,FIHY FISE,,Passeriformes,Old World Flycatchers,Muscicapidae,,,,muscic3
Ficedula semitorquata x albicollis,Semicollared x Collared Flycatcher (hybrid),x00472,hybrid,29566.0,SCFL COFL SEFL,FISE FIAL,,Passeriformes,Old World Flycatchers,Muscicapidae,,,,muscic3
Ficedula hypoleuca x albicollis,European Pied x Collared Flycatcher (hybrid),x00817,hybrid,29567.0,EPFL COFL PIFL,FIHY FIAL,,Passeriformes,Old World Flycatchers,Muscicapidae,,,,muscic3
Phoenicurus phoenicurus x ochruros,Common x Black Redstart (hybrid),x00745,hybrid,29628.0,CORE CRET BLRE,PHOC PHPH,,Passeriformes,Old World Flycatchers,Muscicapidae,,,,muscic3
Phoenicurus phoenicurus x Saxicola rubetra,Common Redstart x Whinchat (hybrid),x00818,hybrid,29667.0,CORE CRET WHIN,PHPH SARU,,Passeriformes,Old World Flycatchers,Muscicapidae,,,,muscic3
Saxicola rubetra x maurus,Whinchat x Siberian Stonechat (hybrid),x01161,hybrid,29684.0,SIST COST ASST WHIN,SAMA SARU,,Passeriformes,Old World Flycatchers,Muscicapidae,,,,muscic3
Oenanthe melanoleuca x pleschanka,Eastern Black-eared x Pied Wheatear (hybrid),x00771,hybrid,29810.0,PIWH EBEW BEWH,OEPL OEME,,Passeriformes,Old World Flycatchers,Muscicapidae,,,,muscic3
Bombycilla garrulus x cedrorum,Bohemian x Cedar Waxwing (hybrid),x01246,hybrid,29889.0,BOWA CEDW CEWA,BOGA BOCE,,Passeriformes,Waxwings,Bombycillidae,,,,bombyc1
Cinnyris pulchellus x melanogastrus,Beautiful x Gorgeous Sunbird (hybrid),x01200,hybrid,30392.0,BESU GOSU,CIPU CIME,,Passeriformes,Sunbirds and Spiderhunters,Nectariniidae,,,,nectar1
Ploceus brachypterus x nigricollis,Olive-naped x Black-necked Weaver (hybrid),bknwea3,hybrid,30784.0,ONWE BNWE,PLBR PLNI,,Passeriformes,Weavers and Allies,Ploceidae,,,,plocei1
Stizoptera bichenovii x Taeniopygia guttata,Double-barred x Zebra Finch (hybrid),x00906,hybrid,31039.0,SZFI DBFI TZFI ZEFI,TAGU STBI,,Passeriformes,Waxbills and Allies,Estrildidae,,,,estril1
Mayrimunia tristissima x leucosticta,Streak-headed x White-spotted Munia (hybrid),x00473,hybrid,31074.0,WSMA SHMU WSMU SHMA,MATR MALE,,Passeriformes,Waxbills and Allies,Estrildidae,,,,estril1
Lonchura punctulata x striata,Scaly-breasted x White-rumped Munia (hybrid),x01069,hybrid,31104.0,SBMU WRMU,LOPU LOST,,Passeriformes,Waxbills and Allies,Estrildidae,,,,estril1
Lonchura punctulata x atricapilla,Scaly-breasted x Chestnut Munia (hybrid),x01174,hybrid,31129.0,SBMU CHMU,LOAT LOPU,,Passeriformes,Waxbills and Allies,Estrildidae,,,,estril1
Lonchura malacca x atricapilla,Tricolored x Chestnut Munia (hybrid),x00932,hybrid,31130.0,TRMU CHMU,LOMA LOAT,,Passeriformes,Waxbills and Allies,Estrildidae,,,,estril1
Lonchura caniceps x castaneothorax,Gray-headed x Chestnut-breasted Munia (hybrid),x01075,hybrid,31168.0,GHMU CBMU CBMA GHMA,LOCA,,Passeriformes,Waxbills and Allies,Estrildidae,,,,estril1
Lonchura flaviprymna x castaneothorax,Yellow-rumped x Chestnut-breasted Munia (hybrid),x00936,hybrid,31169.0,YRMU CBMU CBMA YRMA,LOCA LOFL,,Passeriformes,Waxbills and Allies,Estrildidae,,,,estril1
Amadina fasciata x erythrocephala,Cut-throat x Red-headed Finch (hybrid),x01247,hybrid,31347.0,CUTH CTFI CUTT RHFI,AMFA AMER,,Passeriformes,Waxbills and Allies,Estrildidae,,,,estril1
Passer domesticus x italiae,House x Italian Sparrow (hybrid),x00873,hybrid,31550.0,HOSP ITSP,PADO PAIT,,Passeriformes,Old World Sparrows,Passeridae,,,,passer4
Passer domesticus x hispaniolensis,House x Spanish Sparrow (hybrid),x00645,hybrid,31555.0,SPSP HOSP,PADO PAHI,,Passeriformes,Old World Sparrows,Passeridae,,,,passer4
Passer italiae x hispaniolensis,Italian x Spanish Sparrow (hybrid),x00974,hybrid,31556.0,SPSP ITSP,PAIT PAHI,,Passeriformes,Old World Sparrows,Passeridae,,,,passer4
Passer domesticus x castanopterus,House x Somali Sparrow (hybrid),x00917,hybrid,31563.0,HOSP SOSP,PADO PACA,,Passeriformes,Old World Sparrows,Passeridae,,,,passer4
Passer domesticus x montanus,House x Eurasian Tree Sparrow (hybrid),x00754,hybrid,31613.0,ETSP HOSP,PADO PAMO,,Passeriformes,Old World Sparrows,Passeridae,,,,passer4
Passer hispaniolensis x montanus,Spanish x Eurasian Tree Sparrow (hybrid),x00874,hybrid,31614.0,ETSP SPSP,PAMO PAHI,,Passeriformes,Old World Sparrows,Passeridae,,,,passer4
Motacilla flava x citreola,Western Yellow x Citrine Wagtail (hybrid),x00934,hybrid,31712.0,WYWA CIWA,MOCI MOFL,,Passeriformes,Wagtails and Pipits,Motacillidae,,,,motaci1
Fringilla coelebs x spodiogenys,Common x African Chaffinch (hybrid),x01070,hybrid,31970.0,AFCH EUCH COCH CCHA,FRSP FRCO,,Passeriformes,"Finches, Euphonias, and Allies",Fringillidae,,,,fringi1
Fringilla coelebs x montifringilla,Common Chaffinch x Brambling (hybrid),x01071,hybrid,31975.0,BRAM EUCH CCHA COCH,FRCO FRMO,,Passeriformes,"Finches, Euphonias, and Allies",Fringillidae,,,,fringi1
Himatione sanguinea x Drepanis coccinea,Apapane x Iiwi (hybrid),x00828,hybrid,32119.0,IIWI APAP,HISA DRCO,,Passeriformes,"Finches, Euphonias, and Allies",Fringillidae,,,,fringi1
Leucosticte tephrocotis x atrata,Gray-crowned x Black Rosy-Finch (hybrid),x01003,hybrid,32307.0,BRFI GCRF BLRF,LETE LEAT,,Passeriformes,"Finches, Euphonias, and Allies",Fringillidae,,,,fringi1
Haemorhous mexicanus x purpureus,House x Purple Finch (hybrid),x01004,hybrid,32327.0,PUFI HOFI,HAME HAPU,,Passeriformes,"Finches, Euphonias, and Allies",Fringillidae,,,,fringi1
Carduelis carduelis x caniceps,European x Gray-crowned Goldfinch (hybrid),x01171,hybrid,32568.0,EUGO GCGO WEGO EGOL,CACA,,Passeriformes,"Finches, Euphonias, and Allies",Fringillidae,,,,fringi1
Carduelis carduelis x Serinus canaria,European Goldfinch x Island Canary (hybrid),x01005,hybrid,32576.0,EUGO ISCA WEGO EGOL ATCA,SECA CACA,,Passeriformes,"Finches, Euphonias, and Allies",Fringillidae,,,,fringi1
Loxia curvirostra x Spinus pinus,Red Crossbill x Pine Siskin (hybrid),x00904,hybrid,32601.0,COCR RECR PISI,SPPI LOCU,,Passeriformes,"Finches, Euphonias, and Allies",Fringillidae,,,,fringi1
Spinus pinus x atriceps,Pine x Black-capped Siskin (hybrid),x00829,hybrid,32603.0,BCSI PISI,SPPI SPAT,,Passeriformes,"Finches, Euphonias, and Allies",Fringillidae,,,,fringi1
Carduelis carduelis x Spinus psaltria,European x Lesser Goldfinch (hybrid),x01006,hybrid,32615.0,EUGO LEGO WEGO EGOL,SPPS CACA,,Passeriformes,"Finches, Euphonias, and Allies",Fringillidae,,,,fringi1
Acanthis flammea x Spinus tristis,Redpoll x American Goldfinch (hybrid),x01248,hybrid,32622.0,AGOL REDP AMGO,SPTR ACFL,,Passeriformes,"Finches, Euphonias, and Allies",Fringillidae,,,,fringi1
Carduelis carduelis x Spinus tristis,European x American Goldfinch (hybrid),x01007,hybrid,32623.0,EUGO AMGO AGOL WEGO EGOL,SPTR CACA,,Passeriformes,"Finches, Euphonias, and Allies",Fringillidae,,,,fringi1
Spinus pinus x tristis,Pine Siskin x American Goldfinch (hybrid),x00905,hybrid,32624.0,AGOL AMGO PISI,SPPI SPTR,,Passeriformes,"Finches, Euphonias, and Allies",Fringillidae,,,,fringi1
Spinus psaltria x tristis,Lesser x American Goldfinch (hybrid),x00714,hybrid,32625.0,AGOL LEGO AMGO,SPTR SPPS,,Passeriformes,"Finches, Euphonias, and Allies",Fringillidae,,,,fringi1
Spinus magellanicus x uropygialis,Hooded x Yellow-rumped Siskin (hybrid),x00713,hybrid,32657.0,HOSI YRSI,SPUR SPMA,,Passeriformes,"Finches, Euphonias, and Allies",Fringillidae,,,,fringi1
Calcarius lapponicus x Plectrophenax nivalis,Lapland Longspur x Snow Bunting (hybrid),x00919,hybrid,32679.0,SNBU LALO LABU,CALA PLNI,,Passeriformes,Longspurs and Snow Buntings,Calcariidae,,,,calcar1
Plectrophenax nivalis x hyperboreus,Snow x McKay's Bunting (hybrid),x00447,hybrid,32681.0,SNBU MCBU MKBU,PLHY PLNI,,Passeriformes,Longspurs and Snow Buntings,Calcariidae,,,,calcar1
Emberiza melanocephala x bruniceps,Black-headed x Red-headed Bunting (hybrid),x00871,hybrid,32700.0,BHBU RHBU,EMME EMBR,,Passeriformes,Old World Buntings,Emberizidae,,,,emberi2
Emberiza citrinella x leucocephalos,Yellowhammer x Pine Bunting (hybrid),x00823,hybrid,32740.0,YELL PIBU,EMLE EMCI,,Passeriformes,Old World Buntings,Emberizidae,,,,emberi2
Emberiza tahapisi x goslingi,Cinnamon-breasted x Gosling's Bunting (hybrid),x00975,hybrid,32787.0,CBBU GTBU GOBU,EMGO EMTA,,Passeriformes,Old World Buntings,Emberizidae,,,,emberi2
Spizella passerina x pallida,Chipping x Clay-colored Sparrow (hybrid),x00198,hybrid,32997.0,CHSP CCSP,SPPA,,Passeriformes,New World Sparrows,Passerellidae,,,,passer3
Spizella passerina x pusilla,Chipping x Field Sparrow (hybrid),x00976,hybrid,33005.0,FISP CHSP,SPPA SPPU,,Passeriformes,New World Sparrows,Passerellidae,,,,passer3
Spizella pallida x pusilla,Clay-colored x Field Sparrow (hybrid),x00200,hybrid,33006.0,FISP CCSP,SPPU SPPA,,Passeriformes,New World Sparrows,Passerellidae,,,,passer3
Spizella pallida x breweri,Clay-colored x Brewer's Sparrow (hybrid),x00199,hybrid,33010.0,CCSP BRSP,SPPA SPBR,,Passeriformes,New World Sparrows,Passerellidae,,,,passer3
Spizella atrogularis x breweri,Black-chinned x Brewer's Sparrow (hybrid),x00201,hybrid,33011.0,BCSP BRSP,SPAT SPBR,,Passeriformes,New World Sparrows,Passerellidae,,,,passer3
Junco hyemalis x phaeonotus,Dark-eyed x Yellow-eyed Junco (hybrid),x00869,hybrid,33154.0,YEJU DEJU,JUPH JUHY,,Passeriformes,New World Sparrows,Passerellidae,,,,passer3
Junco hyemalis x Zonotrichia leucophrys,Dark-eyed Junco x White-crowned Sparrow (hybrid),x01016,hybrid,33195.0,WCSP DEJU,ZOLE JUHY,,Passeriformes,New World Sparrows,Passerellidae,,,,passer3
Zonotrichia leucophrys x atricapilla,White-crowned x Golden-crowned Sparrow (hybrid),x00053,hybrid,33197.0,GCSP WCSP,ZOLE ZOAT,,Passeriformes,New World Sparrows,Passerellidae,,,,passer3
Spizelloides arborea x Zonotrichia querula,American Tree x Harris's Sparrow (hybrid),x00752,hybrid,33199.0,ATSP HASP,SPAR ZOQU,,Passeriformes,New World Sparrows,Passerellidae,,,,passer3
Zonotrichia leucophrys x querula,White-crowned x Harris's Sparrow (hybrid),x00900,hybrid,33200.0,WCSP HASP,ZOLE ZOQU,,Passeriformes,New World Sparrows,Passerellidae,,,,passer3
Zonotrichia leucophrys x albicollis,White-crowned x White-throated Sparrow (hybrid),x00451,hybrid,33202.0,WCSP WTSP,ZOLE ZOAL,,Passeriformes,New World Sparrows,Passerellidae,,,,passer3
Zonotrichia atricapilla x albicollis,Golden-crowned x White-throated Sparrow (hybrid),x00720,hybrid,33203.0,GCSP WTSP,ZOAL ZOAT,,Passeriformes,New World Sparrows,Passerellidae,,,,passer3
Junco hyemalis x Zonotrichia albicollis,Dark-eyed Junco x White-throated Sparrow (hybrid),x00039,hybrid,33204.0,WTSP DEJU,JUHY ZOAL,,Passeriformes,New World Sparrows,Passerellidae,,,,passer3
Ammospiza nelsoni x caudacuta,Nelson's x Saltmarsh Sparrow (hybrid),x00450,hybrid,33241.0,NESP SASP SALS,AMCA AMNE,,Passeriformes,New World Sparrows,Passerellidae,,,,passer3
Ammodramus savannarum x Passerculus sandwichensis,Grasshopper x Savannah Sparrow (hybrid),x01057,hybrid,33269.0,GRSP SASP SAVS SBBS,AMSA PASA,,Passeriformes,New World Sparrows,Passerellidae,,,,passer3
Melospiza melodia x lincolnii,Song x Lincoln's Sparrow (hybrid),x00474,hybrid,33314.0,LISP SOSP,MEME MELI,,Passeriformes,New World Sparrows,Passerellidae,,,,passer3
Melospiza melodia x georgiana,Song x Swamp Sparrow (hybrid),x00702,hybrid,33319.0,SWSP SOSP,MEME MEGE,,Passeriformes,New World Sparrows,Passerellidae,,,,passer3
Melozone fusca x aberti,Canyon x Abert's Towhee (hybrid),x00870,hybrid,33348.0,CATO ABTO CANT,MEAB MEFU,,Passeriformes,New World Sparrows,Passerellidae,,,,passer3
Melozone aberti x crissalis,Abert's x California Towhee (hybrid),x01138,hybrid,33356.0,CALT ABTO CATO,MEAB MECR,,Passeriformes,New World Sparrows,Passerellidae,,,,passer3
Arremon brunneinucha x Pipilo maculatus,Chestnut-capped Brushfinch x Spotted Towhee (hybrid),x00475,hybrid,33411.0,SPTO CCBR,PIMA ARBR,,Passeriformes,New World Sparrows,Passerellidae,,,,passer3
Melozone fusca x Pipilo maculatus,Canyon x Spotted Towhee (hybrid),x00476,hybrid,33412.0,CATO SPTO CANT,PIMA MEFU,,Passeriformes,New World Sparrows,Passerellidae,,,,passer3
Melozone crissalis x Pipilo maculatus,California x Spotted Towhee (hybrid),x01249,hybrid,33413.0,CALT SPTO CATO,PIMA MECR,,Passeriformes,New World Sparrows,Passerellidae,,,,passer3
Pipilo chlorurus x maculatus,Green-tailed x Spotted Towhee (hybrid),x00706,hybrid,33414.0,GTTO SPTO,PIMA PICH,,Passeriformes,New World Sparrows,Passerellidae,,,,passer3
Pipilo maculatus x erythrophthalmus,Spotted x Eastern Towhee (hybrid),x00446,hybrid,33422.0,SPTO EATO,PIMA PIER,,Passeriformes,New World Sparrows,Passerellidae,,,,passer3
Pipilo maculatus x ocai,Spotted x Collared Towhee (hybrid),x00445,hybrid,33431.0,COTO SPTO,PIMA PIOC,,Passeriformes,New World Sparrows,Passerellidae,,,,passer3
Atlapetes albinucha x fuscoolivaceus,White-naped x Dusky-headed Brushfinch (hybrid),x01092,hybrid,33468.0,WNBR DHBR,ATFU ATAL,,Passeriformes,New World Sparrows,Passerellidae,,,,passer3
Atlapetes albofrenatus x nigrifrons,Moustached x Black-fronted Brushfinch (hybrid),x01201,hybrid,33485.0,YBBR MOBR BFBR,ATNI ATAL,,Passeriformes,New World Sparrows,Passerellidae,,,,passer3
Atlapetes melanolaemus x rufinucha,Black-faced x Bolivian Brushfinch (hybrid),x00477,hybrid,33516.0,BOBR BFBR GEBR,ATRU ATME,,Passeriformes,New World Sparrows,Passerellidae,,,,passer3
Phaenicophilus palmarum x poliocephalus,Black-crowned x Gray-crowned Palm-Tanager (hybrid),x00901,hybrid,33533.0,BPLT GCPT BCPT,PHPA PHPO,,Passeriformes,Greater Antillean Tanagers,Phaenicophilidae,,,,phaeni1
Teretistris fernandinae x fornsi,Yellow-headed x Oriente Warbler (hybrid),x00935,hybrid,33556.0,ORWA YHWA,TEFO TEFE,,Passeriformes,Cuban Warblers,Teretistridae,,,,tereti1
Sturnella neglecta x magna,Western x Eastern Meadowlark (hybrid),x00827,hybrid,33585.0,EAME WEME,STNE STMA,,Passeriformes,Troupials and Allies,Icteridae,,,,icteri1
Sturnella neglecta x lilianae,Western x Chihuahuan Meadowlark (hybrid),x01085,hybrid,33590.0,CHME WEME,STLI STNE,,Passeriformes,Troupials and Allies,Icteridae,,,,icteri1
Icteria virens x Icterus cucullatus,Yellow-breasted Chat x Hooded Oriole (hybrid),x00478,hybrid,33691.0,HOOR YBCH,ICCU ICVI,,Passeriformes,,,,,,
Icterus spurius x cucullatus,Orchard x Hooded Oriole (hybrid),x01167,hybrid,33692.0,OROR HOOR,ICSP ICCU,,Passeriformes,Troupials and Allies,Icteridae,,,,icteri1
Icterus wagleri x pustulatus,Black-vented x Streak-backed Oriole (hybrid),x00490,hybrid,33735.0,BVOR SBOR SBAO,ICPU ICWA,,Passeriformes,Troupials and Allies,Icteridae,,,,icteri1
Icterus cucullatus x bullockii,Hooded x Bullock's Oriole (hybrid),x01215,hybrid,33739.0,BUOR HOOR,ICCU ICBU,,Passeriformes,Troupials and Allies,Icteridae,,,,icteri1
Icterus gularis x graduacauda,Altamira x Audubon's Oriole (hybrid),x00449,hybrid,33769.0,ALOR AUOR,ICGU ICGR,,Passeriformes,Troupials and Allies,Icteridae,,,,icteri1
Icterus bullockii x galbula,Bullock's x Baltimore Oriole (hybrid),x00013,hybrid,33771.0,BAOR BUOR,ICGA ICBU,BBOH,Passeriformes,Troupials and Allies,Icteridae,,,,icteri1
Icterus bullockii x abeillei,Bullock's x Black-backed Oriole (hybrid),x00903,hybrid,33774.0,BBOR BUOR,ICAB ICBU,,Passeriformes,Troupials and Allies,Icteridae,,,,icteri1
Euphagus cyanocephalus x Quiscalus mexicanus,Brewer's Blackbird x Great-tailed Grackle (hybrid),x00753,hybrid,33875.0,GTGR BRBL,QUME EUCY,,Passeriformes,Troupials and Allies,Icteridae,,,,icteri1
Quiscalus quiscula x mexicanus,Common x Great-tailed Grackle (hybrid),x00479,hybrid,33876.0,COGR GTGR,QUQU QUME,,Passeriformes,Troupials and Allies,Icteridae,,,,icteri1
Quiscalus major x mexicanus,Boat-tailed x Great-tailed Grackle (hybrid),x00977,hybrid,33877.0,GTGR BTGR,QUMA QUME,,Passeriformes,Troupials and Allies,Icteridae,,,,icteri1
Vermivora chrysoptera x cyanoptera,Golden-winged x Blue-winged Warbler (hybrid),x00669,hybrid,33958.0,BWWA GWWA,VECH VECY,GBWH,Passeriformes,New World Warblers,Parulidae,,,,paruli1
Vermivora chrysoptera x cyanoptera (F1 hybrid),Brewster's Warbler (hybrid),brewar,hybrid,33959.0,BWWA GWWA,VECH VECY,BRWA,Passeriformes,New World Warblers,Parulidae,,,,paruli1
Vermivora chrysoptera x cyanoptera (F2 backcross),Lawrence's Warbler (hybrid),lawwar,hybrid,33960.0,BWWA GWWA,VECH VECY,LAWA,Passeriformes,New World Warblers,Parulidae,,,,paruli1
Leiothlypis peregrina x ruficapilla,Tennessee x Nashville Warbler (hybrid),x01013,hybrid,33984.0,TEWA NAWA,LEPE LERU,,Passeriformes,New World Warblers,Parulidae,,,,paruli1
Leiothlypis celata x ruficapilla,Orange-crowned x Nashville Warbler (hybrid),x00819,hybrid,33985.0,NAWA OCWA,LECE LERU,,Passeriformes,New World Warblers,Parulidae,,,,paruli1
Leiothlypis crissalis x virginiae,Colima x Virginia's Warbler (hybrid),x00638,hybrid,33987.0,COLW COWA VIWA,LEVI LECR,,Passeriformes,New World Warblers,Parulidae,,,,paruli1
Oporornis agilis x Geothlypis philadelphia,Connecticut x Mourning Warbler (hybrid),x00746,hybrid,34007.0,MOWA COWA CONW,OPAG GEPH,,Passeriformes,New World Warblers,Parulidae,,,,paruli1
Geothlypis tolmiei x philadelphia,MacGillivray's x Mourning Warbler (hybrid),x00699,hybrid,34008.0,MOWA MGWA MAWA,GETO GEPH,,Passeriformes,New World Warblers,Parulidae,,,,paruli1
Geothlypis philadelphia x formosa,Mourning x Kentucky Warbler (hybrid),x00747,hybrid,34012.0,MOWA KEWA,GEFO GEPH,,Passeriformes,New World Warblers,Parulidae,,,,paruli1
Geothlypis poliocephala x trichas,Gray-crowned x Common Yellowthroat (hybrid),x00748,hybrid,34045.0,GCYE COYE,GEPO GETR,,Passeriformes,New World Warblers,Parulidae,,,,paruli1
Geothlypis tolmiei x trichas,MacGillivray's Warbler x Common Yellowthroat (hybrid),x00700,hybrid,34046.0,MGWA MAWA COYE,GETO GETR,,Passeriformes,New World Warblers,Parulidae,,,,paruli1
Geothlypis philadelphia x trichas,Mourning Warbler x Common Yellowthroat (hybrid),x00749,hybrid,34047.0,MOWA COYE,GETR GEPH,,Passeriformes,New World Warblers,Parulidae,,,,paruli1
Geothlypis formosa x trichas,Kentucky Warbler x Common Yellowthroat (hybrid),x01014,hybrid,34048.0,KEWA COYE,GETR GEFO,,Passeriformes,New World Warblers,Parulidae,,,,paruli1
Vermivora cyanoptera x Setophaga cerulea,Blue-winged x Cerulean Warbler (hybrid),x00480,hybrid,34062.0,CERW BWWA CEWA,VECY SECE,,Passeriformes,New World Warblers,Parulidae,,,,paruli1
Setophaga ruticilla x americana,American Redstart x Northern Parula (hybrid),x00750,hybrid,34064.0,AMRE NOPA,SEAM SERU,,Passeriformes,New World Warblers,Parulidae,,,,paruli1
Setophaga cerulea x americana,Cerulean Warbler x Northern Parula (hybrid),x00711,hybrid,34065.0,CERW NOPA CEWA,SEAM SECE,,Passeriformes,New World Warblers,Parulidae,,,,paruli1
Setophaga americana x pitiayumi,Northern x Tropical Parula (hybrid),x00203,hybrid,34077.0,TRPA NOPA,SEAM SEPI,,Passeriformes,New World Warblers,Parulidae,,,,paruli1
Leiothlypis ruficapilla x Setophaga magnolia,Nashville x Magnolia Warbler (hybrid),x00820,hybrid,34080.0,MAWA NAWA,SEMA LERU,,Passeriformes,New World Warblers,Parulidae,,,,paruli1
Setophaga ruticilla x magnolia,American Redstart x Magnolia Warbler (hybrid),x01072,hybrid,34081.0,AMRE MAWA,SEMA SERU,,Passeriformes,New World Warblers,Parulidae,,,,paruli1
Setophaga tigrina x magnolia,Cape May x Magnolia Warbler (hybrid),x01073,hybrid,34082.0,MAWA CMWA,SEMA SETI,,Passeriformes,New World Warblers,Parulidae,,,,paruli1
